dataset,dataset_slug,doc_id,raw_text,clean_text,dominant_topic,dominant_topic_prob
Before Election,before_election,0,লিডার চালিয়ে যান পুরো পৃথিবী আপনার বিপক্ষে থাকলেও আমি পৃথিবীর পক্ষেই আছি,লিডার চালিয়ে যান পুরো পৃথিবী আপনার বিপক্ষে থাকলেও আমি পৃথিবীর পক্ষেই আছি,4,0.8987685329951471
Before Election,before_election,1,ভোট দিবো ধানের শীর্ষে চাঁদা তুলবো মিলেমিশে,ভোট দিবো ধানের শীর্ষে চাঁদা তুলবো মিলেমিশে,4,0.6005835563148946
Before Election,before_election,2,"ছেলেটা দারুণ সাহসী। এতো জুতা খাওয়ার পরও নতুন নতুন বানী নিয়ে চলে আসে,, বাহ -- লেগে থাক ভাই..",ছেলেটা দারুণ সাহসী এতো জুতা খাওয়ার পরও নতুন নতুন বানী নিয়ে চলে আসে বাহ লেগে থাক ভাই,1,0.5634797738316919
Before Election,before_election,3,জনগণের ইচ্ছে যাকে খুশি তাকে ভোট দিবে দেশ টাকার বাবার না স্বৈরাচারের মতো ব্যবহার করে পরিপাশে আগস্টের মত শেখ হাসিনার মত হবে ইনশাআল্লাহ,জনগণের ইচ্ছে যাকে খুশি তাকে ভোট দিবে দেশ টাকার বাবার না স্বৈরাচারের মতো ব্যবহার করে পরিপাশে আগস্টের মত শেখ হাসিনার মত হবে ইনশাআল্লাহ,4,0.9517694527984296
Before Election,before_election,4,এদেশের গর্ব তুমি ভাই আরও এগিয়ে যাও! পাবনার দিকে,এদেশের গর্ব তুমি ভাই আরও এগিয়ে যাও পাবনার দিকে,0,0.8654056321076551
Before Election,before_election,5,সাহসী নেতার সাহসী বাণী!,সাহসী নেতার সাহসী বাণী,3,0.7999882619106625
Before Election,before_election,6,"""১২ তারিখের পর ওই এলাকার মানুষ ওকে খুঁজবে। আর ও কোথায় থাকবে, তা জানা নেই।",তারিখের পর ওই এলাকার মানুষ ওকে খুঁজবে আর ও কোথায় থাকবে তা জানা নেই,1,0.8987296380330602
Before Election,before_election,7,"তারুণ্যের প্রথম ভোটটি হোক অন্যায়, দুর্নীতি, চাদাবাজি, ঋণ খেলাপির বিরুদ্ধে। ন্যায় সততা ও ইনসাফ এর পক্ষে, শিক্ষিত মার্জিত! একজন ভালো ব্যক্তির পক্ষে!",তারুণ্যের প্রথম ভোটটি হোক অন্যায় দুর্নীতি চাদাবাজি ঋণ খেলাপির বিরুদ্ধে ন্যায় সততা ও ইনসাফ এর পক্ষে শিক্ষিত মার্জিত একজন ভালো ব্যক্তির পক্ষে,1,0.9417831268857871
Before Election,before_election,9,নেতা এমনই হওয়া দরকার,নেতা এমনই হওয়া দরকার,1,0.7977107306798789
Before Election,before_election,10,বেশি লাফালাফি করলে দাঁড়িয়ে থাকতে পারবে না,বেশি লাফালাফি করলে দাঁড়িয়ে থাকতে পারবে না,3,0.864585956350579
Before Election,before_election,11,চাঁদাবাজ মুক্ত সন্ত্রাস মুক্ত দূর্নীতি মুক্ত দেশ গড়তে দাঁড়িপাল্লায় ভোট দিয়ে জয়যুক্ত করুন ইনসাফের রাষ্ট্র গঠন করুন।,চাঁদাবাজ মুক্ত সন্ত্রাস মুক্ত দূর্নীতি মুক্ত দেশ গড়তে দাঁড়িপাল্লায় ভোট দিয়ে জয়যুক্ত করুন ইনসাফের রাষ্ট্র গঠন করুন,4,0.7129698336400478
Before Election,before_election,12,প্রতিহিংসার রাজনীতি না করি কিভাবে দেশে ভালো কিছু করা যায় সেভাবে কাজ করি,প্রতিহিংসার রাজনীতি না করি কিভাবে দেশে ভালো কিছু করা যায় সেভাবে কাজ করি,1,0.9099847634732346
Before Election,before_election,13,"নৌকা গেছে যে পথে, ধানের শীষ যাবে সে পথে। নৌকা আর ধানের শীষ লাঙ্গল দেখাও শেষ, দাঁড়িপাল্লা গড়বে এবার সোনার বাংলাদেশ।",নৌকা গেছে যে পথে ধানের শীষ যাবে সে পথে নৌকা আর ধানের শীষ লাঙ্গল দেখাও শেষ দাঁড়িপাল্লা গড়বে এবার সোনার বাংলাদেশ,4,0.5747854274748149
Before Election,before_election,14,সব জায়গায় একই অবস্থা নির্বাচন বন্ধ করে দেওয়া হোক আমি লীগকে ঘুরিয়ে নিয়ে আনুক তারা বিপক্ষে কোন দলকে সাইট দেয় না হুমকি দিয়ে থাকে প্রতিটা ওয়ার্ড পর্দা থেকে একই অবস্থা,সব জায়গায় একই অবস্থা নির্বাচন বন্ধ করে দেওয়া হোক আমি লীগকে ঘুরিয়ে নিয়ে আনুক তারা বিপক্ষে কোন দলকে সাইট দেয় না হুমকি দিয়ে থাকে প্রতিটা ওয়ার্ড পর্দা থেকে একই অবস্থা,2,0.9548918614160808
Before Election,before_election,15,"দল থেকে দেরকে আজীবনের জন্য বহিষ্কার করা হোক,, নয়তো বিএনপি-র ইজ্জত মাঠে থেকে যাবে বাসায় নিয়ে ফিরতে পারবে না",দল থেকে দেরকে আজীবনের জন্য বহিষ্কার করা হোক নয়তো বিএনপি র ইজ্জত মাঠে থেকে যাবে বাসায় নিয়ে ফিরতে পারবে না,1,0.9320500666807018
Before Election,before_election,16,ক্ষমতা আসার আগেই এতো কিছু। ক্ষমতা আসার পর কি হবে একমাত্র আল্লাহ জানে,ক্ষমতা আসার আগেই এতো কিছু ক্ষমতা আসার পর কি হবে একমাত্র আল্লাহ জানে,0,0.9265727413649408
Before Election,before_election,17,"দেশের জনগণ এখন সচেতন। জোরজবরদস্তির রাজনীতি এখন আর চলবে না মানুষ আদর্শবান নেতা চায়, যার হাতে নিরাপদ দেশ ও জাতি",দেশের জনগণ এখন সচেতন জোরজবরদস্তির রাজনীতি এখন আর চলবে না মানুষ আদর্শবান নেতা চায় যার হাতে নিরাপদ দেশ ও জাতি,1,0.9353683703608262
Before Election,before_election,18,এই বক্তব্য জামাতের কেউ দিলে রাকিব চাচা দল বল নিয়ে রাস্তায় নাইমে যাতো,এই বক্তব্য জামাতের কেউ দিলে রাকিব চাচা দল বল নিয়ে রাস্তায় নাইমে যাতো,3,0.8845988391574902
Before Election,before_election,19,বিএনপি আস্তে আস্তে আসল রূপে ফিরে আসতেছে,বিএনপি আস্তে আস্তে আসল রূপে ফিরে আসতেছে,0,0.3994448666413477
Before Election,before_election,20,"একবারে আওমী সন্ত্রাসীদের হুংকার দিয়ে ভোটারদের জিম্মি করতে চাই,এগুলো কে জনগন আর ভয় করে না।",একবারে আওমী সন্ত্রাসীদের হুংকার দিয়ে ভোটারদের জিম্মি করতে চাই এগুলো কে জনগন আর ভয় করে না,3,0.88475195263835
Before Election,before_election,21,নব্য ফ্যাসিজম,নব্য ফ্যাসিজম,0,0.2
Before Election,before_election,22,ভালবাসা দিয়ে মানুষের মন জয় করতে হয় ভয় দেখিয়ে নয়,ভালবাসা দিয়ে মানুষের মন জয় করতে হয় ভয় দেখিয়ে নয়,3,0.8989975218386514
Before Election,before_election,23,ওকে দশটা জুতার বাড়ি দেওয়া হোক,ওকে দশটা জুতার বাড়ি দেওয়া হোক,4,0.8380489109010659
Before Election,before_election,24,দেন উনাকে ভাইরাল করে চান্দে উঠাইবেন,দেন উনাকে ভাইরাল করে চান্দে উঠাইবেন,1,0.7314542424843238
Before Election,before_election,25,এই পাগল ছাগলরা দলটাকে শেষ করে দিলো,এই পাগল ছাগলরা দলটাকে শেষ করে দিলো,0,0.7993504727941604
Before Election,before_election,26,এই সময় এই ধরনের শব্দ যেই করবে দল থেকে বহিষ্কার করা উচিৎ। আজকাল এই গুলো মানুষ ভয়পায়না।,এই সময় এই ধরনের শব্দ যেই করবে দল থেকে বহিষ্কার করা উচিৎ আজকাল এই গুলো মানুষ ভয়পায়না,1,0.8990254032298144
Before Election,before_election,27,এজন্যই ত জাতি এঁদের থেকে মুখ ফিরিয়ে নিয়েছে।,এজন্যই ত জাতি এঁদের থেকে মুখ ফিরিয়ে নিয়েছে,2,0.8654801380218551
Before Election,before_election,28,দম্ভ ধ্বংস হোক,দম্ভ ধ্বংস হোক,1,0.59544059585183
Before Election,before_election,29,এরকম কিছু পাগল না থাকলে নির্বাচনীয় মাঠ গরম হয় না।,এরকম কিছু পাগল না থাকলে নির্বাচনীয় মাঠ গরম হয় না,0,0.7967130152695641
Before Election,before_election,30,ভোট দিবো কিশে ধানের শীষে,ভোট দিবো কিশে ধানের শীষে,4,0.8398870814444858
Before Election,before_election,31,আপনাদের জরিপটা সুন্দর লাগলো এটাই বাস্তব আর অন্যগুলোতে সবাই শক্ত অবস্থায় আছে সেখান থেকে কিছু সিট বিএনপি পাবে মোটামুটি,আপনাদের জরিপটা সুন্দর লাগলো এটাই বাস্তব আর অন্যগুলোতে সবাই শক্ত অবস্থায় আছে সেখান থেকে কিছু সিট বিএনপি পাবে মোটামুটি,2,0.5279368933887063
Before Election,before_election,32,ইনশাআল্লাহ ধানের শীষ আমি আসা করি বিএনপি ক্ষমায় আসলে বাংলাদেশ নতুন বাংলাদেশ হয়ে উঠবে আবার,ইনশাআল্লাহ ধানের শীষ আমি আসা করি বিএনপি ক্ষমায় আসলে বাংলাদেশ নতুন বাংলাদেশ হয়ে উঠবে আবার,4,0.552466601194346
Before Election,before_election,33,যে মন পঞ্চগড় এক আসন বিএনপি ধানের শীষ জিতবে,যে মন পঞ্চগড় এক আসন বিএনপি ধানের শীষ জিতবে,4,0.8842458298478216
Before Election,before_election,34,কুমিল্লা নাঙ্গলকোট আসন বিএনপি বিশাল ভোটে জয় লাভ করবে,কুমিল্লা নাঙ্গলকোট আসন বিএনপি বিশাল ভোটে জয় লাভ করবে,4,0.8845227944394735
Before Election,before_election,35,পাগলের সুখ নাকি মনে মনে এই পাগলামি নির্বাচনের পরে কোথায় থাকবে আপনার,পাগলের সুখ নাকি মনে মনে এই পাগলামি নির্বাচনের পরে কোথায় থাকবে আপনার,3,0.6450945585268831
Before Election,before_election,36,আমাদের মুন্সিগন্জ জেলার ২ নং আসন লৌহজং ও টংগি বাড়ি এডভোকেট আব্দুল সালাম আজাদ ১০০% নিসচিত ইনশাআল্লাহ,আমাদের মুন্সিগন্জ জেলার নং আসন লৌহজং ও টংগি বাড়ি এডভোকেট আব্দুল সালাম আজাদ নিসচিত ইনশাআল্লাহ,4,0.7976318074782197
Before Election,before_election,37,এই খবর দেখে আপনারা বিএনপির ভাইরা আনন্দে গদ গদ ইয়েন না। ফলাফল ঘরে তোলা পর্যন্ত অতন্দ্র প্রহরীর মত ভোট কেন্দ্র পাহারা দিবেন ।সবার বড় দায়িত্ব মহিলাদের ভোট কেন্দ্রে নিয়ে ভোট দেয়ানো ।ভোট দেয়ার পর মহিলাদের সম্মানের সহিত বাড়িতে পৌছে দিতে হবে,এই খবর দেখে আপনারা বিএনপির ভাইরা আনন্দে গদ গদ ইয়েন না ফলাফল ঘরে তোলা পর্যন্ত অতন্দ্র প্রহরীর মত ভোট কেন্দ্র পাহারা দিবেন সবার বড় দায়িত্ব মহিলাদের ভোট কেন্দ্রে নিয়ে ভোট দেয়ানো ভোট দেয়ার পর মহিলাদের সম্মানের সহিত বাড়িতে পৌছে দিতে হবে,4,0.684051012485055
Before Election,before_election,38,আপনার ধারণা অনেকটাই সত্য।,আপনার ধারণা অনেকটাই সত্য,0,0.7303085720470137
Before Election,before_election,39,সঠিক মোট ২২০ পাবে,সঠিক মোট পাবে,2,0.7283263886735313
Before Election,before_election,40,লক্ষীপুর জেলায় কোন আসন না পেলেও লক্ষীপুর ৪ শতভাগ নিশ্চিত ইনশাআল্লাহ,লক্ষীপুর জেলায় কোন আসন না পেলেও লক্ষীপুর শতভাগ নিশ্চিত ইনশাআল্লাহ,2,0.33819306601582794
Before Election,before_election,41,নোয়াখালী পাঁচ ফখরুল ইসলাম 100%,নোয়াখালী পাঁচ ফখরুল ইসলাম,2,0.8385583454108954
Before Election,before_election,42,হবিগঞ্জ সদর আছে নাম্বার ওয়ান আলকাত জি কে গোস বিপুল পুরে পাস হইবো বিপুল ভোটে,হবিগঞ্জ সদর আছে নাম্বার ওয়ান আলকাত জি কে গোস বিপুল পুরে পাস হইবো বিপুল ভোটে,1,0.9104330105007217
Before Election,before_election,43,কিসের বি এন পি পাবে ৪২০ আসন,কিসের বি এন পি পাবে আসন,2,0.883915899631631
Before Election,before_election,44,তাহলে আর নির্বাচন দরকার কি।,তাহলে আর নির্বাচন দরকার কি,1,0.7974413800384683
Before Election,before_election,45,আপনার জরিপ আমার খুব পছন্দ হয়েছে তবে আরও বেশি আসন পাবে বিএনপি,আপনার জরিপ আমার খুব পছন্দ হয়েছে তবে আরও বেশি আসন পাবে বিএনপি,2,0.8848822232089605
Before Election,before_election,46,২৮ কুড়িগ্রাম ৪ বিএন পি জয় নিশ্চিত ইনশাআল্লাহ।,কুড়িগ্রাম বিএন পি জয় নিশ্চিত ইনশাআল্লাহ,4,0.4118049443196786
Before Election,before_election,47,চুয়াডাঙ্গা এক আসন জেলা বিএনপি ৭০% ভোটার এগিয়ে আছে চুয়াডাঙ্গা শরিফুজ্জামান শরীফ ভাই এমপি প্রার্থী হবে,চুয়াডাঙ্গা এক আসন জেলা বিএনপি ভোটার এগিয়ে আছে চুয়াডাঙ্গা শরিফুজ্জামান শরীফ ভাই এমপি প্রার্থী হবে,2,0.9169748541833852
Before Election,before_election,48,সময় টিভি কে জয় বাংলা করা হবে শনিবার দিন,সময় টিভি কে জয় বাংলা করা হবে শনিবার দিন,4,0.7990786598825329
Before Election,before_election,49,এত বড় গুনিনরা যখন গননা করে দিয়েছে তখন আর ভোটের দরকার কি? রাত থেকেই ফ্যামিলি কার্ড দেওয়া শুরু করে দিক।,এত বড় গুনিনরা যখন গননা করে দিয়েছে তখন আর ভোটের দরকার কি রাত থেকেই ফ্যামিলি কার্ড দেওয়া শুরু করে দিক,3,0.4483166636359996
Before Election,before_election,50,এমন ততথো উঠে আসে সুধু সময় টিভিতে,এমন ততথো উঠে আসে সুধু সময় টিভিতে,3,0.8374104341063137
Before Election,before_election,52,মিডিয়া তো দেখছি ১দলিয় কাজ করছে,মিডিয়া তো দেখছি দলিয় কাজ করছে,4,0.7934845559313359
Before Election,before_election,53,বিএনপির ইশরাকের কর্মীরা রাতে ভোট দিতে গিয়ে জনতার কাছে ধরা। ভোটকেন্দ্র পাহারা দাও ছাত্র-জনতা।,বিএনপির ইশরাকের কর্মীরা রাতে ভোট দিতে গিয়ে জনতার কাছে ধরা ভোটকেন্দ্র পাহারা দাও ছাত্র জনতা,4,0.9458050604133444
Before Election,before_election,54,ইনশাআল্লাহ বিজয় আমাদের,ইনশাআল্লাহ বিজয় আমাদের,4,0.7333304600591576
Before Election,before_election,55,ইনশাআল্লাহ ধানের শীষের বিজয় সুনিশ্চিত,ইনশাআল্লাহ ধানের শীষের বিজয় সুনিশ্চিত,4,0.8666635869052015
Before Election,before_election,56,ইনশাআল্লাহ দাড়ি পাল্লা বিজয় হবে,ইনশাআল্লাহ দাড়ি পাল্লা বিজয় হবে,4,0.8395363505603856
Before Election,before_election,57,"সবাই নাহিদ ভাইকেই দেয়া উচিৎ,,, বিএনপি আওয়ামিলীগ অনেকবার পাওয়ারে আসছে, জনগ উপর শুধু জুলুম করছে তারা,,আল্লাহ দেশের মানুষ কে হেফাজত করুক,, জালিমের হাত থেকে,,",সবাই নাহিদ ভাইকেই দেয়া উচিৎ বিএনপি আওয়ামিলীগ অনেকবার পাওয়ারে আসছে জনগ উপর শুধু জুলুম করছে তারা আল্লাহ দেশের মানুষ কে হেফাজত করুক জালিমের হাত থেকে,1,0.9375950179768997
Before Election,before_election,58,নাহিদ ভাই নিশ্চিত ১০০%,নাহিদ ভাই নিশ্চিত,0,0.7984240407182334
Before Election,before_election,60,"নতুন প্রজন্ম ভোট দিবে নাহিদ শাপলা কলি কে,,,কিন্তু পুরান আমলের মানুস ভোট দিবে ধানের শীষ",নতুন প্রজন্ম ভোট দিবে নাহিদ শাপলা কলি কে কিন্তু পুরান আমলের মানুস ভোট দিবে ধানের শীষ,4,0.5112709902519591
Before Election,before_election,61,কাইয়ুম জিতবে,কাইয়ুম জিতবে,4,0.5980511813383588
Before Election,before_election,62,শাপলা কলি,শাপলা কলি,2,0.7333281162403549
Before Election,before_election,63,শাপলাকলি,শাপলাকলি,0,0.2
Before Election,before_election,64,এবার প্রথম ভোট ধানের শীষেই দেবো ইনশাআল্লাহ।,এবার প্রথম ভোট ধানের শীষেই দেবো ইনশাআল্লাহ,4,0.8851119208560839
Before Election,before_election,65,মোবাইলে কল দিয়ে ভোট চাচ্ছে এর মানে বুজতে হবে নির্বাচনে অবৈধ ভাবে টাকা করতেছে,মোবাইলে কল দিয়ে ভোট চাচ্ছে এর মানে বুজতে হবে নির্বাচনে অবৈধ ভাবে টাকা করতেছে,2,0.9099383203682385
Before Election,before_election,66,ইত্তেফাক গুটিকয়েক জামায়াত নিয়ে ভোটের জরিপ করে জনগণকে বিভ্রান্ত করার চেষ্টা করতেছে...!! আশাকরি আগামী ১২/০২/২০২৬ইং তাদের এই ভাঁওতাবাজির মুখোশ উন্মোচন হবে ইনশাআল্লাহ।,ইত্তেফাক গুটিকয়েক জামায়াত নিয়ে ভোটের জরিপ করে জনগণকে বিভ্রান্ত করার চেষ্টা করতেছে আশাকরি আগামী ইং তাদের এই ভাঁওতাবাজির মুখোশ উন্মোচন হবে ইনশাআল্লাহ,4,0.925759644538331
