dataset,dataset_slug,doc_id,raw_text,clean_text,dominant_topic,dominant_topic_prob
After Forming Government,after_forming_government,1126,নাউজুবিল্লাহ,নাউজুবিল্লাহ,0,0.2
After Forming Government,after_forming_government,1127,সুন্দর ও সাবলীল ভাবে মিথ্যা বলার জন্য ধন্যবাদ,সুন্দর ও সাবলীল ভাবে মিথ্যা বলার জন্য ধন্যবাদ,2,0.6378880663899477
After Forming Government,after_forming_government,1128,কারণ তারা আগেই আখের গুছিয়েছিলো,কারণ তারা আগেই আখের গুছিয়েছিলো,3,0.5976993581385436
After Forming Government,after_forming_government,1129,কিন্তু চাদাবাজি করবে,কিন্তু চাদাবাজি করবে,0,0.2
After Forming Government,after_forming_government,1130,চাঁদার টাকায় নিবে। সমস্যা কি,চাঁদার টাকায় নিবে সমস্যা কি,3,0.6093587907618315
After Forming Government,after_forming_government,1131,যদি জামায়াত ইসলামির কপি করে তাহলে বলবো।,যদি জামায়াত ইসলামির কপি করে তাহলে বলবো,2,0.7981776467556606
After Forming Government,after_forming_government,1132,জনগণের স্বার্থে হলে তাদের সাধুবাদ জানাই।,জনগণের স্বার্থে হলে তাদের সাধুবাদ জানাই,1,0.8386483884327413
After Forming Government,after_forming_government,1133,দেখার অপেক্ষা কত টুকু জামায়াতের কর্মকাণ্ডের সাথে মিল রেখে নিজেদের স্বচ্ছতা নিশ্চিত করে।,দেখার অপেক্ষা কত টুকু জামায়াতের কর্মকাণ্ডের সাথে মিল রেখে নিজেদের স্বচ্ছতা নিশ্চিত করে,0,0.47084223087259314
After Forming Government,after_forming_government,1134,ট্যাক্স ফ্রী গারি এনে জমজমাট ব্যবসা করতে পারবে,ট্যাক্স ফ্রী গারি এনে জমজমাট ব্যবসা করতে পারবে,2,0.7979801448758226
After Forming Government,after_forming_government,1135,vitore vitore koto kichu nibe,vitore vitore koto kichu nibe,0,0.5999728228786947
After Forming Government,after_forming_government,1136,আলহামদুলিল্লাহ অভিনন্দন,আলহামদুলিল্লাহ অভিনন্দন,1,0.7330555574513081
After Forming Government,after_forming_government,1137,আলহামদুলিল্লাহ,আলহামদুলিল্লাহ,1,0.5999985657252962
After Forming Government,after_forming_government,1138,ওরেপ বাবা,ওরেপ বাবা,2,0.5985995773408128
After Forming Government,after_forming_government,1139,খুব ভালো একটা ডিসিশন,খুব ভালো একটা ডিসিশন,1,0.7311537791220423
After Forming Government,after_forming_government,1140,কাজে বিশ্বাসি,কাজে বিশ্বাসি,0,0.5999993474333682
After Forming Government,after_forming_government,1141,ভালো উদ্যোগ,ভালো উদ্যোগ,1,0.7311578867952874
After Forming Government,after_forming_government,1142,জামায়াত নিজে খাবে না কাউকে খেতেও দিবে না,জামায়াত নিজে খাবে না কাউকে খেতেও দিবে না,2,0.5375466756687336
After Forming Government,after_forming_government,1143,ব্যবসায় লস হয়ে গেলো,ব্যবসায় লস হয়ে গেলো,4,0.5995305668814791
After Forming Government,after_forming_government,1144,জুলাই ভোগে?,জুলাই ভোগে,4,0.594535280226526
After Forming Government,after_forming_government,1145,ধন্যবাদ বিএনপিকে,ধন্যবাদ বিএনপিকে,1,0.7327340619518872
After Forming Government,after_forming_government,1146,cut copy paste,cut copy paste,0,0.5999827505384704
After Forming Government,after_forming_government,1147,"খুবই ভালো লাগলো, জামায়াত কে অনুসরন করার জন্য, এভাবে সবাই যদি ভালো কাজ কে অনুসরন করে তাহল অদুর ভবিষ্যতে ভালো কিছু আশা করা যায়",খুবই ভালো লাগলো জামায়াত কে অনুসরন করার জন্য এভাবে সবাই যদি ভালো কাজ কে অনুসরন করে তাহল অদুর ভবিষ্যতে ভালো কিছু আশা করা যায়,2,0.9378396009223251
After Forming Government,after_forming_government,1148,আবার জুলাই এর জন্য প্রস্তুতি নেন দেশ রক্ষায়,আবার জুলাই এর জন্য প্রস্তুতি নেন দেশ রক্ষায়,3,0.8630618948180542
After Forming Government,after_forming_government,1149,প্রতি মাসের খরচ টা যেন ওয়েবসাইটে দেওয়া হয়।,প্রতি মাসের খরচ টা যেন ওয়েবসাইটে দেওয়া হয়,1,0.8614615896386608
After Forming Government,after_forming_government,1150,তাদের এই সিদ্ধান্তকে সাধুবাদ জানাই তবে সেই সাথে মন্দ কাজকেও না বলতে হবে।,তাদের এই সিদ্ধান্তকে সাধুবাদ জানাই তবে সেই সাথে মন্দ কাজকেও না বলতে হবে,1,0.799265830709011
After Forming Government,after_forming_government,1151,জুলাই যোদ্ধারা আবার রাজপথে দেখা হচ্ছে ইনশাআল্লাহ,জুলাই যোদ্ধারা আবার রাজপথে দেখা হচ্ছে ইনশাআল্লাহ,3,0.8841499284194367
After Forming Government,after_forming_government,1152,গনপরিষদ শপথ না করায় জুলাই গাদ্দার হিসেবে আর্ত্মপ্রকাশ করলো BNP,গনপরিষদ শপথ না করায় জুলাই গাদ্দার হিসেবে আর্ত্মপ্রকাশ করলো bnp,4,0.7013671217339795
After Forming Government,after_forming_government,1153,সকারি,সকারি,0,0.2
After Forming Government,after_forming_government,1154,সরকারি,সরকারি,4,0.596745897898948
After Forming Government,after_forming_government,1155,সংসদীয় দলের প্রথম সভায় সিদ্ধান্ত হয়েছে —,সংসদীয় দলের প্রথম সভায় সিদ্ধান্ত হয়েছে,1,0.5087753282556473
After Forming Government,after_forming_government,1156,বিএনপির কোনো সম্মানিত সংসদ সদস্য ডিউটি-ফ্রি গাড়ি গ্রহণ করবেন না।,বিএনপির কোনো সম্মানিত সংসদ সদস্য ডিউটি ফ্রি গাড়ি গ্রহণ করবেন না,4,0.8982547667556771
After Forming Government,after_forming_government,1157,সরকারি বরাদ্দে কোনো প্লট গ্রহণ করবেন না।,সরকারি বরাদ্দে কোনো প্লট গ্রহণ করবেন না,4,0.5301909933305282
After Forming Government,after_forming_government,1158,"★তারেক রহমান পরিবর্তন এর জন্য এসেছেন, এ ঘুনেধরা সমাজ বদলাতে এসেছেন।",তারেক রহমান পরিবর্তন এর জন্য এসেছেন এ ঘুনেধরা সমাজ বদলাতে এসেছেন,2,0.8656472422150054
After Forming Government,after_forming_government,1159,"জুলাই না হলে যে নির্বাচনই হতো না, সেই ‍জুলাইয়ের সাথে প্রথম গা*দ্দারিটা করল বিএনপি।",জুলাই না হলে যে নির্বাচনই হতো না সেই জুলাইয়ের সাথে প্রথম গা দ্দারিটা করল বিএনপি,3,0.909056574648868
After Forming Government,after_forming_government,1160,যেরকম চান্দাবাজি করে এগুলো না নিলেও চলবে,যেরকম চান্দাবাজি করে এগুলো না নিলেও চলবে,4,0.7978709083286628
After Forming Government,after_forming_government,1161,Alhamdulillah,alhamdulillah,0,0.599982747468404
After Forming Government,after_forming_government,1162,এই সিদ্ধান্ত নুরুল হক নুর মানছে নি?,এই সিদ্ধান্ত নুরুল হক নুর মানছে নি,4,0.44942691249986605
After Forming Government,after_forming_government,1163,আহা পরান্ডা বাচাইলা। দেশ গিলে খাবে,আহা পরান্ডা বাচাইলা দেশ গিলে খাবে,4,0.7977417023006483
After Forming Government,after_forming_government,1164,জামাতের কপি,জামাতের কপি,2,0.3999589136588863
After Forming Government,after_forming_government,1165,এর জন্য জামাত দায়ী,এর জন্য জামাত দায়ী,4,0.5992883831816079
After Forming Government,after_forming_government,1166,"নাটক বাজ চোর,র দল",নাটক বাজ চোর র দল,2,0.8374366127930156
After Forming Government,after_forming_government,1167,dekha jabe .oti vokti chorer lokkhon,dekha jabe oti vokti chorer lokkhon,1,0.732970951707216
After Forming Government,after_forming_government,1168,জামাত শিবির এনসিপির একটা রাজনৈতিক পতন,জামাত শিবির এনসিপির একটা রাজনৈতিক পতন,4,0.8398167574499603
After Forming Government,after_forming_government,1169,"মাধার্বোড এটা বলছে জামায়াতের সদস্য রা, আর তোরা এটা বিএমপি বলে চালিয়ে দিছত,দালালের বাচ্চারা,পা চাটা চাটি আবার শুরু করছত",মাধার্বোড এটা বলছে জামায়াতের সদস্য রা আর তোরা এটা বিএমপি বলে চালিয়ে দিছত দালালের বাচ্চারা পা চাটা চাটি আবার শুরু করছত,1,0.32451752952722074
After Forming Government,after_forming_government,1170,হালার বাটবাপ,হালার বাটবাপ,0,0.2
After Forming Government,after_forming_government,1171,চান্দাবাজ,চান্দাবাজ,0,0.2
After Forming Government,after_forming_government,1172,আলহামদুলিল্লাহ্,আলহামদুলিল্লাহ্,2,0.5999683531588976
After Forming Government,after_forming_government,1173,তাহলে আরো বেশি চুরি করবে,তাহলে আরো বেশি চুরি করবে,2,0.8378354434511686
After Forming Government,after_forming_government,1176,প্রধানমন্ত্রী - লন্ডন |,প্রধানমন্ত্রী লন্ডন,4,0.7321746526880271
After Forming Government,after_forming_government,1177,স্বরাষ্ট্র - ভারত | পররাষ্ট্র - আমেরিকা |,স্বরাষ্ট্র ভারত পররাষ্ট্র আমেরিকা,0,0.2
After Forming Government,after_forming_government,1178,| সুষম বন্টন |,সুষম বন্টন,0,0.2
After Forming Government,after_forming_government,1179,আল্লাহ পাক তারেক রহমান কে,আল্লাহ পাক তারেক রহমান কে,2,0.8399085176009253
After Forming Government,after_forming_government,1180,রাষ্ট্রীয় মর্যাদা ও সম্মান রাখার,রাষ্ট্রীয় মর্যাদা ও সম্মান রাখার,2,0.7333227037021856
After Forming Government,after_forming_government,1181,তৌফিক দান করুক।,তৌফিক দান করুক,2,0.5501448448963734
After Forming Government,after_forming_government,1182,"“ভোটের সময় নেতা, ভোটের পর শাসক—এটাই রাজনীতির মুখোশ”।",ভোটের সময় নেতা ভোটের পর শাসক এটাই রাজনীতির মুখোশ,4,0.7250100102950934
After Forming Government,after_forming_government,1183,বেগম খালেদা জিয়া রাষ্ট্রপতি জিয়াউর রহমানের আল্লাহ যেন উনাদেরকে দান করে আমিন,বেগম খালেদা জিয়া রাষ্ট্রপতি জিয়াউর রহমানের আল্লাহ যেন উনাদেরকে দান করে আমিন,2,0.7261634702498381
After Forming Government,after_forming_government,1184,"আলহামদুলিল্লাহ, দেশ এগিয়ে নিবেন তারেক রহমান,",আলহামদুলিল্লাহ দেশ এগিয়ে নিবেন তারেক রহমান,2,0.7105259088798374
After Forming Government,after_forming_government,1185,রাব্বির হাম হুমা কামা রাব্বা ইয়ানি সাগিরা।,রাব্বির হাম হুমা কামা রাব্বা ইয়ানি সাগিরা,0,0.2
After Forming Government,after_forming_government,1186,সেদিনই না করলো আজ আবারও,সেদিনই না করলো আজ আবারও,1,0.4992873372526227
After Forming Government,after_forming_government,1187,মহান আল্লাহ তাদের জান্নাতবাসী করুক,মহান আল্লাহ তাদের জান্নাতবাসী করুক,2,0.5198926639076001
After Forming Government,after_forming_government,1188,যারা তাদের প্রতিশ্রুতি ভংগ করে তাদের কি বলে ?,যারা তাদের প্রতিশ্রুতি ভংগ করে তাদের কি বলে,4,0.798714546369774
After Forming Government,after_forming_government,1189,"জুলাই সনদের অংগীকার নামাতে এখনো তাদের স্বাক্ষর রয়ে গেছে । যেখানে তারা ওয়াদা করেছিল, হ্যা ভোট জয়যুক্ত হলে, সংস্কার বাস্তবায়ন করা হবে। গনভোটে মোট ভোটার সংখ্যা ছিল ৭ কোটি, হ্যাঁ ভোটের সংখ্যা চার কোটি ৮০ লাখ । ৬৮% মার্জিনে ""হ্যা"" জয়যুক্ত হয়েছে ।",জুলাই সনদের অংগীকার নামাতে এখনো তাদের স্বাক্ষর রয়ে গেছে যেখানে তারা ওয়াদা করেছিল হ্যা ভোট জয়যুক্ত হলে সংস্কার বাস্তবায়ন করা হবে গনভোটে মোট ভোটার সংখ্যা ছিল কোটি হ্যাঁ ভোটের সংখ্যা চার কোটি লাখ মার্জিনে হ্যা জয়যুক্ত হয়েছে,4,0.6047742928641888
After Forming Government,after_forming_government,1190,"গনভোট অধ্যাদেশ আইন অনুযায়ীই এটা ১৮০ দিনের মাঝে বাস্তবায়ন করতে হবে । এটাই ছিল ওয়াদা । আমি এখনো বিশ্বাস রাখতে চাই, সরকার তার ওয়াদা রাখবে ।",গনভোট অধ্যাদেশ আইন অনুযায়ীই এটা দিনের মাঝে বাস্তবায়ন করতে হবে এটাই ছিল ওয়াদা আমি এখনো বিশ্বাস রাখতে চাই সরকার তার ওয়াদা রাখবে,4,0.4417392942119935
After Forming Government,after_forming_government,1191,"Dear BNP, Don't Betray Bangladesh . Give us a clean and accountable system. History will remember you.",dear bnp don t betray bangladesh give us a clean and accountable system history will remember you,1,0.5740135236236659
After Forming Government,after_forming_government,1192,দেশ বাঁশির দোয়া যেন আল্লাহ জনাব তারেক রহমান কে রাষ্ট্রের সম্মান মযাদা রাখতে পারে সেই তৌফিক দিও। এই দোয়া করি এবং উনার বাবা মায়ের সম্মান রাখতে পারে।,দেশ বাঁশির দোয়া যেন আল্লাহ জনাব তারেক রহমান কে রাষ্ট্রের সম্মান মযাদা রাখতে পারে সেই তৌফিক দিও এই দোয়া করি এবং উনার বাবা মায়ের সম্মান রাখতে পারে,2,0.5882612008742167
After Forming Government,after_forming_government,1193,জুলাই না কিছুই হতো না,জুলাই না কিছুই হতো না,1,0.795673020335868
After Forming Government,after_forming_government,1194,দেশ নায়ক তারেক রহমানের মনের বাসনা পূর্ণ করুক সবার আগে বাংলাদেশ,দেশ নায়ক তারেক রহমানের মনের বাসনা পূর্ণ করুক সবার আগে বাংলাদেশ,2,0.6311139407477404
After Forming Government,after_forming_government,1195,Ekhon amra ki korbo,ekhon amra ki korbo,3,0.799791698780155
After Forming Government,after_forming_government,1196,মহিলারা কি কবর জিয়ারত করতে পারে?,মহিলারা কি কবর জিয়ারত করতে পারে,2,0.7989431074197993
After Forming Government,after_forming_government,1197,So ki koram?,so ki koram,3,0.4004755760562492
After Forming Government,after_forming_government,1198,ফেমেলি।কাট্।দেবেনআামার।নাম।সাজাহান।সরকার আমার।মোবাইল নামবার ০১৩০৩৯৩৪৭৫৮,ফেমেলি কাট্ দেবেনআামার নাম সাজাহান সরকার আমার মোবাইল নামবার,4,0.7993280929689198
After Forming Government,after_forming_government,1199,আলহামদুলিল্লাহ,আলহামদুলিল্লাহ,1,0.5999985657252962
After Forming Government,after_forming_government,1200,বিরোধীদল মুনাকিফরা নাকি শপথ নিবে না...!,বিরোধীদল মুনাকিফরা নাকি শপথ নিবে না,3,0.48437444111597694
After Forming Government,after_forming_government,1201,পাকিস্থান চলে যাবে নাকি?,পাকিস্থান চলে যাবে নাকি,3,0.7990660784771383
After Forming Government,after_forming_government,1202,কোকো আজ নেই বলে তার মেয়েদেরকে কেউ মূল্যায়ন করতেছে না ওনারা তিনজন সব জায়গায় থাকে কিন্তু দুইটা মেয়েরে দেখা যায়,কোকো আজ নেই বলে তার মেয়েদেরকে কেউ মূল্যায়ন করতেছে না ওনারা তিনজন সব জায়গায় থাকে কিন্তু দুইটা মেয়েরে দেখা যায়,1,0.7308325683951387
After Forming Government,after_forming_government,1203,আলহামদুলিল্লাহ আল্লাহ নেক হায়াত দান করুন আমিন সুম্মা আমিন।,আলহামদুলিল্লাহ আল্লাহ নেক হায়াত দান করুন আমিন সুম্মা আমিন,2,0.6728636344571889
After Forming Government,after_forming_government,1204,আগামী ১৮ ফেব্রুয়ারি ১ম তারাবি এবং ১৯ ফেব্রুয়ারি ১ম রোজা।,আগামী ফেব্রুয়ারি ম তারাবি এবং ফেব্রুয়ারি ম রোজা,2,0.8391002092899708
After Forming Government,after_forming_government,1205,আলহামদুলিল্লাহ।,আলহামদুলিল্লাহ,1,0.5999985657252962
After Forming Government,after_forming_government,1206,Allahummaa Amin,allahummaa amin,0,0.2
After Forming Government,after_forming_government,1207,Benomro Sroddha,benomro sroddha,0,0.2
After Forming Government,after_forming_government,1208,Ameen,ameen,2,0.5999816924904564
After Forming Government,after_forming_government,1209,আল্লাহ ওয়াস্তে রোযায় ইফতার সেহেরীর জন্য সাহায্য করেন।বৃদ্ধ বাবা মা সহ আমরা সবাই রোযা থাকি।আল্লাহ কসম ঘরে চালও নাই শুধু ভাত খেয়ে রোযা রাখার।দয়া করেন ভাই মিথ্যা বললে আল্লাহ যেন আপনাদের পাপ আমার মাথায় দেয় আর আমার নেক আমল আপনাদের দেয়। ভাই আপনারত রোযায় দান সদকাহ করেন আল্লাহ ওয়াস্তে আমা বাবা মা কে ইফতার সেহির করাবেন।,আল্লাহ ওয়াস্তে রোযায় ইফতার সেহেরীর জন্য সাহায্য করেন বৃদ্ধ বাবা মা সহ আমরা সবাই রোযা থাকি আল্লাহ কসম ঘরে চালও নাই শুধু ভাত খেয়ে রোযা রাখার দয়া করেন ভাই মিথ্যা বললে আল্লাহ যেন আপনাদের পাপ আমার মাথায় দেয় আর আমার নেক আমল আপনাদের দেয় ভাই আপনারত রোযায় দান সদকাহ করেন আল্লাহ ওয়াস্তে আমা বাবা মা কে ইফতার সেহির করাবেন,2,0.9821422635470713
After Forming Government,after_forming_government,1210,বিকাশ ও নগদ নাম্বার 01731825118,বিকাশ ও নগদ নাম্বার,1,0.7327494640698093
