dataset,dataset_slug,doc_id,raw_text,clean_text,dominant_topic,dominant_topic_prob
Before Election,before_election,886,তোমাদের নেতা কে যেরকম,তোমাদের নেতা কে যেরকম,0,0.7286294846687176
Before Election,before_election,887,গাবগাছ আংকের নাসিরের স্কয়ার গাড়ির সাইড কিট চুরি করছে কে??,গাবগাছ আংকের নাসিরের স্কয়ার গাড়ির সাইড কিট চুরি করছে কে,4,0.7980860014493575
Before Election,before_election,888,আব্বাস উদ্দিন এম পি হওয়া শ্যাস,আব্বাস উদ্দিন এম পি হওয়া শ্যাস,2,0.6812565317703336
Before Election,before_election,889,সোনার বাংলাদেশ,সোনার বাংলাদেশ,4,0.7326817423671842
Before Election,before_election,890,কাকু আপনার বয়স হয়েছে এবার অবসরে যান!,কাকু আপনার বয়স হয়েছে এবার অবসরে যান,4,0.8646586566567387
Before Election,before_election,891,আর কতো চাঁদা নিবেন ৪বার এমপি হয়েতো অনেক লুটছেন এবার থামেন কাকু!,আর কতো চাঁদা নিবেন বার এমপি হয়েতো অনেক লুটছেন এবার থামেন কাকু,4,0.8990189112035382
Before Election,before_election,892,⍨ ক্ষমতার চেয়ার না জনতার চেয়ার,ক্ষমতার চেয়ার না জনতার চেয়ার,4,0.8396327972611501
Before Election,before_election,893,Dhaka big Mafia,dhaka big mafia,4,0.5999809110718674
Before Election,before_election,894,Corer mukhe ram ram,corer mukhe ram ram,0,0.2
Before Election,before_election,895,জিয়তছে তো অনেক কষ্টে আওয়ামী লীগ থাকলে তাও জীবনে জিততেন না যদি আওয়ামী লীগের পক্ষ থেকে কলা গাছ দাড়াইলো ওই কলা গাছে জিতবে,জিয়তছে তো অনেক কষ্টে আওয়ামী লীগ থাকলে তাও জীবনে জিততেন না যদি আওয়ামী লীগের পক্ষ থেকে কলা গাছ দাড়াইলো ওই কলা গাছে জিতবে,1,0.9188772490973801
Before Election,before_election,896,Vote chor,vote chor,2,0.7316554897114516
Before Election,before_election,897,এবার একটু আল্লাহরে ভয় করেন এক পা কবরে আপনার এত অমানুষ এর খাতায় নাম লিখাইয়েন নাহ যেনো মরলেও মানুষ খুশিতে নাচে,এবার একটু আল্লাহরে ভয় করেন এক পা কবরে আপনার এত অমানুষ এর খাতায় নাম লিখাইয়েন নাহ যেনো মরলেও মানুষ খুশিতে নাচে,2,0.9321508990864472
Before Election,before_election,898,"ঢাকা ৮, ১৩,১৭ এই আসন গুলোর ভোট লাইভে গণনার জন্য জোর দাবী জানাচ্ছি।",ঢাকা এই আসন গুলোর ভোট লাইভে গণনার জন্য জোর দাবী জানাচ্ছি,0,0.49631236946948576
Before Election,before_election,899,ডাকাত,ডাকাত,1,0.5999503349476272
Before Election,before_election,900,পৃথিবীতে সবচেয়ে সুখী মানুষ বিএনপির সকল কর্মী কারন তাদের কোনো লজ্জা শরম নাই ।,পৃথিবীতে সবচেয়ে সুখী মানুষ বিএনপির সকল কর্মী কারন তাদের কোনো লজ্জা শরম নাই,2,0.9183157913642286
Before Election,before_election,901,"তাদের নেতাকর্মীদের গ্রহন করবে,এটা তো বললেন না।আপনাদের জন্য আওয়ামী লীগ ঠিক ছিল।",তাদের নেতাকর্মীদের গ্রহন করবে এটা তো বললেন না আপনাদের জন্য আওয়ামী লীগ ঠিক ছিল,1,0.5245948882894175
Before Election,before_election,902,কাক্কু মনে হয় ফেল,কাক্কু মনে হয় ফেল,3,0.7985519935986981
Before Election,before_election,903,চুরা আব্বাস,চুরা আব্বাস,1,0.5999986119652783
Before Election,before_election,904,এ হালারে দেখতে আর ভালো লাগেনা,এ হালারে দেখতে আর ভালো লাগেনা,4,0.79482336841643
Before Election,before_election,905,অহংকারী ধংশ হবে,অহংকারী ধংশ হবে,0,0.2
Before Election,before_election,906,Aoyamilig protihoto thakbe ar Abbas ar chadabaji obbahoto thakbe,aoyamilig protihoto thakbe ar abbas ar chadabaji obbahoto thakbe,1,0.799876951971643
Before Election,before_election,907,এক ঝুড়ি আরেক ঝুড়িকে বলে তোর পিছনে ছি*দ্র*,এক ঝুড়ি আরেক ঝুড়িকে বলে তোর পিছনে ছি দ্র,0,0.5627204832147782
Before Election,before_election,908,"Balur track er bishoy ta jodi bolten, oi somoy onk soto cilam.",balur track er bishoy ta jodi bolten oi somoy onk soto cilam,0,0.7319235848838062
Before Election,before_election,909,Chanda Vai,chanda vai,1,0.599981767974939
Before Election,before_election,910,না না না এইটা তো ঠিক না... ওদের DNA-ই তো ভারতের,না না না এইটা তো ঠিক না ওদের dna ই তো ভারতের,2,0.7324671910035907
Before Election,before_election,911,ai ta to age thaie laganu ache,ai ta to age thaie laganu ache,3,0.8388677190438462
Before Election,before_election,912,চান্দার ঘুম হারাম হয়ে গেছে,চান্দার ঘুম হারাম হয়ে গেছে,1,0.3989078276318109
Before Election,before_election,913,কেও রং লাগাইয়ো না সরাসরি ভারতি বলো।,কেও রং লাগাইয়ো না সরাসরি ভারতি বলো,2,0.8390033004017645
Before Election,before_election,914,আপনার দিন শেষ,আপনার দিন শেষ,3,0.5995629382706702
Before Election,before_election,915,হাদির খুনি,হাদির খুনি,1,0.7329631505822022
Before Election,before_election,916,চাঁদাবাজ,চাঁদাবাজ,1,0.5997295584070261
Before Election,before_election,917,আপনার তো চোর তাই বলেছে বুকের দম থাকলে দেখায় দেন সত্যিকারে অর্থে নির্বাচন কে জিতে,আপনার তো চোর তাই বলেছে বুকের দম থাকলে দেখায় দেন সত্যিকারে অর্থে নির্বাচন কে জিতে,0,0.5711670789443106
Before Election,before_election,918,"রঙ কেন লাগাবে, রং নিজেই মেখেছো",রঙ কেন লাগাবে রং নিজেই মেখেছো,2,0.4413262472813409
Before Election,before_election,919,সবাই আমার ভাইকে ভুলে গেলেন.....,সবাই আমার ভাইকে ভুলে গেলেন,4,0.8353578293232253
Before Election,before_election,920,#WeAreHadi #JusticeForHadi #justiceforhadibhai #WeAreOsmanHadi,wearehadi justiceforhadi justiceforhadibhai weareosmanhadi,1,0.7999887772724333
Before Election,before_election,921,Abbas bhai thik ache,abbas bhai thik ache,3,0.5488695914024588
Before Election,before_election,922,মাফিয়ার ডন,মাফিয়ার ডন,0,0.2
Before Election,before_election,923,হেতির চান্দিতে সুটার ফয়সালে চেহাড়া ভেসে ওঠে,হেতির চান্দিতে সুটার ফয়সালে চেহাড়া ভেসে ওঠে,0,0.2
Before Election,before_election,924,#WeAreHadi,wearehadi,1,0.5999684785683055
Before Election,before_election,925,এই কথাটা যাতে ঠিক থাকে,এই কথাটা যাতে ঠিক থাকে,2,0.6413445535137245
Before Election,before_election,926,আওয়ামী লীগের মতো আচরণ যারাই করবে জনগণ তাদের প্রত্যাখ্যান করবে ইনশাআল্লাহ,আওয়ামী লীগের মতো আচরণ যারাই করবে জনগণ তাদের প্রত্যাখ্যান করবে ইনশাআল্লাহ,0,0.46589488538619994
Before Election,before_election,927,অল্পের জন্য স্টক করে মরেন নি,অল্পের জন্য স্টক করে মরেন নি,2,0.7322430661024978
Before Election,before_election,928,জাওরা গাবগাছ,জাওরা গাবগাছ,4,0.5986347935039771
Before Election,before_election,929,চোরের মায়ের বড় গলা,চোরের মায়ের বড় গলা,4,0.639523070172135
Before Election,before_election,930,Chanda abbas vote chor no.1,chanda abbas vote chor no,1,0.8390265452401685
Before Election,before_election,931,কারন তর মতো বাটপাড় কেউই নির্বাচনে দাড়ায় নাই...,কারন তর মতো বাটপাড় কেউই নির্বাচনে দাড়ায় নাই,4,0.5785239442973625
Before Election,before_election,932,স্বৈরাচার মুক্ত দেশ গড়তে গণভোটে হ্যা দিন।,স্বৈরাচার মুক্ত দেশ গড়তে গণভোটে হ্যা দিন,0,0.5153852546998069
Before Election,before_election,933,ভারতীয় আগ্রাসন রুখতে গণভোটে হ্যা দিন।,ভারতীয় আগ্রাসন রুখতে গণভোটে হ্যা দিন,3,0.798492584783555
Before Election,before_election,934,মির্জা গাবগাছ,মির্জা গাবগাছ,1,0.7297243353995939
Before Election,before_election,936,দাদু কেমন আছেন আপনি পকেটে চাদার টাকা ডুকতে দেরি হচ্ছে,দাদু কেমন আছেন আপনি পকেটে চাদার টাকা ডুকতে দেরি হচ্ছে,4,0.8974063631707462
Before Election,before_election,937,ভোটকেন্দ্র আপনার স্ত্রীকে ঢুকিয়ে বুট ধান্দাবাজি করছেন।,ভোটকেন্দ্র আপনার স্ত্রীকে ঢুকিয়ে বুট ধান্দাবাজি করছেন,2,0.8396347872132173
Before Election,before_election,939,#JusticeForHadi #WeAreOsmanHadi,justiceforhadi weareosmanhadi,1,0.7333188909075079
Before Election,before_election,940,মোদীর বাচ্চা,মোদীর বাচ্চা,2,0.5999874961427094
Before Election,before_election,942,#killarmirza,killarmirza,0,0.2
Before Election,before_election,943,আইডিতে গিয়ে একটা ফলে দিলে ভরপুর ভালেবাসা পাইবেন এবং ফলে বেগ পাইবেন,আইডিতে গিয়ে একটা ফলে দিলে ভরপুর ভালেবাসা পাইবেন এবং ফলে বেগ পাইবেন,3,0.8655254579019052
Before Election,before_election,944,আওয়ামী লীগ এর প্রশ্রয় দেওয়ার প্রমাণ তো পথে ঘাটেই দেখা যাচ্ছে,আওয়ামী লীগ এর প্রশ্রয় দেওয়ার প্রমাণ তো পথে ঘাটেই দেখা যাচ্ছে,1,0.638819518569119
Before Election,before_election,945,এবার চাঁদাবাজ রে কোন লোক ভোট দেবে না,এবার চাঁদাবাজ রে কোন লোক ভোট দেবে না,1,0.3784181584057125
Before Election,before_election,946,স্বৈরাচার ফ্যাসিজমের বিরুদ্ধে দাড়ান।,স্বৈরাচার ফ্যাসিজমের বিরুদ্ধে দাড়ান,1,0.7279016771294469
Before Election,before_election,947,খান্কিরছেলে কয় কি রে,খান্কিরছেলে কয় কি রে,1,0.599987056691292
Before Election,before_election,948,শহীদ শরীফ ওসমান হাদীর হত্যার পিছনে আপনার হাত আছে এটা বাংলাদেশের জনগণ জানে,শহীদ শরীফ ওসমান হাদীর হত্যার পিছনে আপনার হাত আছে এটা বাংলাদেশের জনগণ জানে,1,0.9269535854301371
Before Election,before_election,949,পূর্বের ১৭ বছর আপনারা বাল ফালাইছেন না এখন বড় বড় লেকচার ছাড়,পূর্বের বছর আপনারা বাল ফালাইছেন না এখন বড় বড় লেকচার ছাড়,3,0.899375973884068
Before Election,before_election,950,"এই দেশের মানুষ, আওয়ামীলীগ ও হাসিনাকে গ্রহণ করবে না কিন্তু আওয়ামীলীগের পদস্থবিদের বিএনপিতে যোগ দিবে ? বাটপার",এই দেশের মানুষ আওয়ামীলীগ ও হাসিনাকে গ্রহণ করবে না কিন্তু আওয়ামীলীগের পদস্থবিদের বিএনপিতে যোগ দিবে বাটপার,0,0.9259372883480995
Before Election,before_election,951,"#JusticeForHadi আমার ভাইয়ের রক্ত খেয়ে কাউকে হজম করতে দেবো না হাদী ভাই আমাদের এমপি, আমাদের সরকার",justiceforhadi আমার ভাইয়ের রক্ত খেয়ে কাউকে হজম করতে দেবো না হাদী ভাই আমাদের এমপি আমাদের সরকার,1,0.5057476808736808
Before Election,before_election,952,কেননা সব সাইটে বাংলাদেশের স্বৈরাচার হাসিনাকে সরাল এত ছাত্র জনতা মির্জা আব্বাস কোন বিষয় না এটা,কেননা সব সাইটে বাংলাদেশের স্বৈরাচার হাসিনাকে সরাল এত ছাত্র জনতা মির্জা আব্বাস কোন বিষয় না এটা,1,0.6377206135618076
Before Election,before_election,953,"আমার তো মনে হয় আপনি হয় স্টক করতেন,,নয়তো সুইসাইড করতেন",আমার তো মনে হয় আপনি হয় স্টক করতেন নয়তো সুইসাইড করতেন,3,0.8656856572491043
Before Election,before_election,954,Kako fail,kako fail,3,0.5999660370687125
Before Election,before_election,955,আব্বাস হাদী হত্যাকারীর পরিকল্পনাকারী,আব্বাস হাদী হত্যাকারীর পরিকল্পনাকারী,1,0.799992323216461
Before Election,before_election,957,Hadir khuni abbas,hadir khuni abbas,2,0.797389498964966
Before Election,before_election,958,Nasir by,nasir by,0,0.2
Before Election,before_election,959,বিএনপি একমাত্র রাজনৈতিক দল যারা ক্ষমতায় যাওয়ার আগেই বাংলাদেশের সর্বস্তরের জনগণ তাদের পতন চায়,বিএনপি একমাত্র রাজনৈতিক দল যারা ক্ষমতায় যাওয়ার আগেই বাংলাদেশের সর্বস্তরের জনগণ তাদের পতন চায়,1,0.861653264963995
Before Election,before_election,960,ঢাকা ৮ আপনি পাবেন না মশাই।,ঢাকা আপনি পাবেন না মশাই,0,0.7290890576864768
Before Election,before_election,961,ভারতের রং লাগানো আছে বর্তমানে বিএনপিদের গায়ে।,ভারতের রং লাগানো আছে বর্তমানে বিএনপিদের গায়ে,2,0.8396809802150452
Before Election,before_election,962,দুধে ধোয়া তুলসী পাতা,দুধে ধোয়া তুলসী পাতা,3,0.5999660397453825
Before Election,before_election,963,ইনশাআল্লাহ,ইনশাআল্লাহ,4,0.5976223214210143
Before Election,before_election,964,আপনার দলের লোকরাই তো আস্রয় দিচ্ছে এক অংগে কতো পদের রুপ,আপনার দলের লোকরাই তো আস্রয় দিচ্ছে এক অংগে কতো পদের রুপ,0,0.8384921636128447
Before Election,before_election,965,চান্দা আব্বাসউদ্দীন,চান্দা আব্বাসউদ্দীন,0,0.596688551262712
Before Election,before_election,966,সম্পর্ক বদলে গেলো একটি পলকে ভোট চুরের কারণে মির্জা আব্বাস আসলো সংসদে,সম্পর্ক বদলে গেলো একটি পলকে ভোট চুরের কারণে মির্জা আব্বাস আসলো সংসদে,1,0.7420393958635783
Before Election,before_election,967,আপনার বউ হয়েনাকি আসবে হাসিনা কি ?,আপনার বউ হয়েনাকি আসবে হাসিনা কি,0,0.7324920546671461
Before Election,before_election,968,"এটা আবার কেমন রং, এবারের ঈদে আমিও ইউনিক ভারতীয় রঙের জুতো পড়তে চাই",এটা আবার কেমন রং এবারের ঈদে আমিও ইউনিক ভারতীয় রঙের জুতো পড়তে চাই,3,0.5216716030468908
Before Election,before_election,969,"ভারতের ডান হাত ছিল আওয়ামীলীগ,,, এবং বাম হাত b*p,,,কথা টা মিলিয়ে দেইখেই",ভারতের ডান হাত ছিল আওয়ামীলীগ এবং বাম হাত b p কথা টা মিলিয়ে দেইখেই,1,0.882736545795643
Before Election,before_election,970,কথা যেনো ঠিক থাকে,কথা যেনো ঠিক থাকে,2,0.7993772380356622
Before Election,before_election,971,চোরের মায়ের লম্বা গলা কথাটা আজ বাস্তবে পরিণত হলো,চোরের মায়ের লম্বা গলা কথাটা আজ বাস্তবে পরিণত হলো,4,0.8984785369750301
Before Election,before_election,972,শালা চান্দা আব্বাস,শালা চান্দা আব্বাস,0,0.445574996272481
Before Election,before_election,973,বুইড়া চুন্নি আব্বাসনি কই,বুইড়া চুন্নি আব্বাসনি কই,4,0.7277990970725763
Before Election,before_election,974,remember,remember,0,0.2
Before Election,before_election,975,Keno bharat pochhondo koren e toh,keno bharat pochhondo koren e toh,4,0.5999595391460114
Before Election,before_election,976,Candabaz,candabaz,0,0.2
Before Election,before_election,977,"দুর্নীতিবাজ,",দুর্নীতিবাজ,4,0.5999810892492793
Before Election,before_election,978,"আকাম করছো তাহলে কেমনে মেনে নেয় মানুষ,",আকাম করছো তাহলে কেমনে মেনে নেয় মানুষ,2,0.8987896254114478
Before Election,before_election,979,ভূতের মুখে রাম রাম,ভূতের মুখে রাম রাম,1,0.8399200544806057
Before Election,before_election,980,আমরা আশাবাদী জনগণ ভোটের মাঠে প্রমান করবে।,আমরা আশাবাদী জনগণ ভোটের মাঠে প্রমান করবে,4,0.47688004109858706
Before Election,before_election,981,নানা আপনি অবসরে চলে যান।,নানা আপনি অবসরে চলে যান,0,0.7983587481034699
Before Election,before_election,982,নোয়াখালী এখন কুমিল্লার যারা ঢাকা ৮ আসনের ভোটার আছেন দয়া করে আপনারা সবাই নাসির উদ্দিন পাটোয়ারী কে ভোট দিবেন,নোয়াখালী এখন কুমিল্লার যারা ঢাকা আসনের ভোটার আছেন দয়া করে আপনারা সবাই নাসির উদ্দিন পাটোয়ারী কে ভোট দিবেন,2,0.8433431118568114
Before Election,before_election,983,যারা আওয়ামীলীগ করতেন তারা কি এরে ভোট দিবেন,যারা আওয়ামীলীগ করতেন তারা কি এরে ভোট দিবেন,0,0.8830390222028193
Before Election,before_election,984,ইনশাআল্লাহ আমরা হ্যাঁ ভোটের মাধ্যমে দেশের সর্বস্তরের জনগণ মিলে সন্ত্রাস চান্দাবাজ টেন্ডারবাজ মুক্ত একটি নতুন বাংলাদেশ গড়তে চাই,ইনশাআল্লাহ আমরা হ্যাঁ ভোটের মাধ্যমে দেশের সর্বস্তরের জনগণ মিলে সন্ত্রাস চান্দাবাজ টেন্ডারবাজ মুক্ত একটি নতুন বাংলাদেশ গড়তে চাই,0,0.5138557194808415
Before Election,before_election,986,#Saluting_Our_Cultural_Hero,saluting our cultural hero,0,0.2
Before Election,before_election,987,শাপলা কলি জিন্দাবাদ,শাপলা কলি জিন্দাবাদ,4,0.799996909406753
Before Election,before_election,988,"মানুষকে ভোটকেন্দ্রে যেতে দিয়েন, যার ভোট তাকে দেয়ার সুযোগ দিয়েন। তাহলেই বুঝবেন আসল খেলা কি।",মানুষকে ভোটকেন্দ্রে যেতে দিয়েন যার ভোট তাকে দেয়ার সুযোগ দিয়েন তাহলেই বুঝবেন আসল খেলা কি,0,0.9379486923435468
Before Election,before_election,989,Mirza abbas BNP inshallah,mirza abbas bnp inshallah,2,0.7971413759665189
Before Election,before_election,990,চাদা আব্বাস হারবে সে খুনি,চাদা আব্বাস হারবে সে খুনি,1,0.4754821739979183
Before Election,before_election,991,Public hase,public hase,0,0.2
Before Election,before_election,992,হাদিকে সরিয়ে দেওয়ার পিছনে জামাত কাজ করেছে। হাদি একমাত্র আওয়ামী লীগ ও জঙ্গি জামাতের অন্তরায় ছিলো।,হাদিকে সরিয়ে দেওয়ার পিছনে জামাত কাজ করেছে হাদি একমাত্র আওয়ামী লীগ ও জঙ্গি জামাতের অন্তরায় ছিলো,1,0.9328783970550232
