dataset,dataset_slug,doc_id,raw_text,clean_text,dominant_topic,dominant_topic_prob
Before Election,before_election,271,"রাইট,দাড়িপাল্লার জয়দেখে এরকম করে।",রাইট দাড়িপাল্লার জয়দেখে এরকম করে,4,0.7982140377454845
Before Election,before_election,272,ধানের শিসে ভোট দিন,ধানের শিসে ভোট দিন,4,0.4457382545204066
Before Election,before_election,273,জয় হোক জনতার বিএনপি জিন্দাবাদ।,জয় হোক জনতার বিএনপি জিন্দাবাদ,4,0.8659707677431444
Before Election,before_election,274,লিডার আপনাকে অনেক ধন্যবাদ আপনার পরিকল্পনা গুলো যেন বাস্তবায়ন হয়,লিডার আপনাকে অনেক ধন্যবাদ আপনার পরিকল্পনা গুলো যেন বাস্তবায়ন হয়,0,0.5339362093470985
Before Election,before_election,275,সবার আগে বাংলাদেশ,সবার আগে বাংলাদেশ,4,0.5976959538454039
Before Election,before_election,276,ফরিদপুর সদর ত আসনের নীতি,ফরিদপুর সদর ত আসনের নীতি,1,0.7310403462726996
Before Election,before_election,277,"যিনি কুরআন তেলাওয়াত করেছেন, একজন আলেম মানুষ তার জন্য কি একটা চেয়ার হয় না, তাকে একটি চেয়ারে বসিয়ে দেয়া হোক।",যিনি কুরআন তেলাওয়াত করেছেন একজন আলেম মানুষ তার জন্য কি একটা চেয়ার হয় না তাকে একটি চেয়ারে বসিয়ে দেয়া হোক,0,0.588248078248543
Before Election,before_election,278,জুলাই সনদ আস‌লে কি?,জুলাই সনদ আস লে কি,2,0.5978478598930245
Before Election,before_election,279,"হ‌্যাঁ ভোট বা না ভোট, কোনটা দেয়া উ‌চিত?",হ ্যাঁ ভোট বা না ভোট কোনটা দেয়া উ চিত,0,0.7985486220512568
Before Election,before_election,280,"অভিনন্দন, চমৎকার এবং সময়োপযোগী একটি ইশতেহার দেয়ার জন্য।",অভিনন্দন চমৎকার এবং সময়োপযোগী একটি ইশতেহার দেয়ার জন্য,4,0.7293855868070069
Before Election,before_election,281,ইনশাআল্লাহ বিএনপি বিজয় হবে,ইনশাআল্লাহ বিএনপি বিজয় হবে,4,0.7981344883204269
Before Election,before_election,282,ধানের শীর্ষ ধানের শীর্ষ,ধানের শীর্ষ ধানের শীর্ষ,4,0.4405064319649839
Before Election,before_election,283,সবার আগে বাংলাদেশ,সবার আগে বাংলাদেশ,4,0.5976959538454039
Before Election,before_election,284,কারণ ওরা বুঝে গেছে এখন জনগণ কোন পথে,কারণ ওরা বুঝে গেছে এখন জনগণ কোন পথে,1,0.8391809954129701
Before Election,before_election,286,কথা টা রাইট,কথা টা রাইট,4,0.7323703734783055
Before Election,before_election,287,ঠিক আছে,ঠিক আছে,2,0.5971299051194318
Before Election,before_election,288,হাতপাখা জিন্দাবাদ,হাতপাখা জিন্দাবাদ,4,0.5999971267733704
Before Election,before_election,290,ঠিক বলেছেন ম্যাডাম ধন্যবাদ আপনাকে ঠিক বলেছেন,ঠিক বলেছেন ম্যাডাম ধন্যবাদ আপনাকে ঠিক বলেছেন,2,0.8982923547129482
Before Election,before_election,291,তরুণ প্রজন্মের প্রথম ভোট ধানের শীষের,তরুণ প্রজন্মের প্রথম ভোট ধানের শীষের,4,0.5341523381859994
Before Election,before_election,292,পক্ষে হোক,পক্ষে হোক,4,0.7331991212933943
Before Election,before_election,293,"চাঁদাবাজি দুর্নীতি নৈরাজ্য ঘুষ সন্ত্রাসের মুক্ত হোক, ইনসাফের বাংলাদেশ যুক্ত হোক। ইনক্লাব জিন্দাবাদ।",চাঁদাবাজি দুর্নীতি নৈরাজ্য ঘুষ সন্ত্রাসের মুক্ত হোক ইনসাফের বাংলাদেশ যুক্ত হোক ইনক্লাব জিন্দাবাদ,4,0.659528554344859
Before Election,before_election,294,ইন্সাআল্লাহ জিতবে ধানের শীষ। স্বাধীনতাবিরোধী রাজনৈতিক দল নিপাত যাক।,ইন্সাআল্লাহ জিতবে ধানের শীষ স্বাধীনতাবিরোধী রাজনৈতিক দল নিপাত যাক,4,0.3927605069187879
Before Election,before_election,295,ইনশাআল্লাহ দাঁড়িপাল্লার জয় নিশ্চিত,ইনশাআল্লাহ দাঁড়িপাল্লার জয় নিশ্চিত,0,0.8380599883250055
Before Election,before_election,296,তারুণ্যের প্রথম ভোট ইনসাফের পক্ষে হোক হঠাও চাঁদাবাজ বাচাও দেশ দাড়িপাল্লার বাংলাদেশ,তারুণ্যের প্রথম ভোট ইনসাফের পক্ষে হোক হঠাও চাঁদাবাজ বাচাও দেশ দাড়িপাল্লার বাংলাদেশ,4,0.7380802753091028
Before Election,before_election,297,এটা বিএনপির জন্যই মানায়,এটা বিএনপির জন্যই মানায়,1,0.7288524533489793
Before Election,before_election,298,ভয় কাজ করছে,ভয় কাজ করছে,0,0.7316701192995642
Before Election,before_election,299,হারলেই বলবে নির্বাচন সুষ্ঠ হয়নি জিতলে বলবে নির্বাচন সুষ্ঠ হয়েছে,হারলেই বলবে নির্বাচন সুষ্ঠ হয়নি জিতলে বলবে নির্বাচন সুষ্ঠ হয়েছে,2,0.910694603631056
Before Election,before_election,300,বিএনপি নেতাকর্মী এবং পুলিং এজেন্ট গুলি আরো কঠোর নজরদারি থাকতে হবে সারাদেশে ভোট জালিয়াতি টাকা ছড়াছড়ি হচ্ছে।,বিএনপি নেতাকর্মী এবং পুলিং এজেন্ট গুলি আরো কঠোর নজরদারি থাকতে হবে সারাদেশে ভোট জালিয়াতি টাকা ছড়াছড়ি হচ্ছে,3,0.9093355663974251
Before Election,before_election,301,"""১২ তারিখ, সারাদিন ধানের শীষে ভোট দিন। ইনশাআল্লাহ, আমাদের জয় হবে!",তারিখ সারাদিন ধানের শীষে ভোট দিন ইনশাআল্লাহ আমাদের জয় হবে,0,0.8985002100133116
Before Election,before_election,302,বিএনপি ভালো করেই জানেন নির্বাচন সুষ্ঠু হবে এবং তারা হারবে এজন্য তারা উল্টাপাল্টা কথা বলতেছে।,বিএনপি ভালো করেই জানেন নির্বাচন সুষ্ঠু হবে এবং তারা হারবে এজন্য তারা উল্টাপাল্টা কথা বলতেছে,0,0.7466755290036231
Before Election,before_election,303,ধানের শীষের জয় হবেই ইনশাআল্লাহ,ধানের শীষের জয় হবেই ইনশাআল্লাহ,4,0.8664660622163027
Before Election,before_election,304,ইনশাআল্লাহ ধানের শীষের বিজয় হবেই হবে।,ইনশাআল্লাহ ধানের শীষের বিজয় হবেই হবে,4,0.8665170601659425
Before Election,before_election,305,এখন পর্যন্ত সংবাদ মাধ্যম গুলোর মধ্যে যা দেখতে পেলাম সবচেয়ে বেশি বিএনপির নেতাকর কর্মীরা সবচেয়ে বেশি অ্যারেস্ট হয়েছে অস্ত্র নিয়ে,এখন পর্যন্ত সংবাদ মাধ্যম গুলোর মধ্যে যা দেখতে পেলাম সবচেয়ে বেশি বিএনপির নেতাকর কর্মীরা সবচেয়ে বেশি অ্যারেস্ট হয়েছে অস্ত্র নিয়ে,1,0.9323856498255263
Before Election,before_election,306,"বাগেরহাট, ১আসনে কফিলকৃষ্ণ মন্ডল বিকল্প নেই",বাগেরহাট আসনে কফিলকৃষ্ণ মন্ডল বিকল্প নেই,1,0.7975340139768118
Before Election,before_election,307,তারেক রহমান জিন্দাবাদ,তারেক রহমান জিন্দাবাদ,4,0.7997913058271116
Before Election,before_election,308,মগবাজারে আগুন লাগিয়ে দিয়েছেন লিডার,মগবাজারে আগুন লাগিয়ে দিয়েছেন লিডার,0,0.548230070642977
Before Election,before_election,309,বাগেরহাট ৩ লায়ন ডক্টর শেখ ফরিদুল ইসলাম,বাগেরহাট লায়ন ডক্টর শেখ ফরিদুল ইসলাম,4,0.7900117523238213
Before Election,before_election,310,ধন্যবাদ ভাইয়া,ধন্যবাদ ভাইয়া,4,0.5996099300726555
Before Election,before_election,311,ধানের শীস,ধানের শীস,4,0.7331522959577423
Before Election,before_election,312,জয়বালা,জয়বালা,0,0.2
Before Election,before_election,313,রাইট কথা বলছো,রাইট কথা বলছো,4,0.5999743383732106
Before Election,before_election,314,ধন্যবাদ ধন্যবাদ,ধন্যবাদ ধন্যবাদ,4,0.7331072944024652
Before Election,before_election,315,মাগুরা জেলা,মাগুরা জেলা,2,0.5990063706094011
Before Election,before_election,316,দেখা হবে বিজয়ে,দেখা হবে বিজয়ে,3,0.5999936839096742
Before Election,before_election,317,ইনশাআল্লাহ ধানের শীষের বিজয়ী হবে,ইনশাআল্লাহ ধানের শীষের বিজয়ী হবে,4,0.8396914528922476
Before Election,before_election,318,জামায়াত বয়কট,জামায়াত বয়কট,1,0.7323412184903152
Before Election,before_election,319,বাংলাদেশের জনগণ,বাংলাদেশের জনগণ,1,0.7317756289553139
Before Election,before_election,320,খুলনা বিভাগের পক্ষ থেকে আপনাকে জানাই স্বাগতম প্রিয় লিডার জনাব তারেক রহমান,খুলনা বিভাগের পক্ষ থেকে আপনাকে জানাই স্বাগতম প্রিয় লিডার জনাব তারেক রহমান,4,0.9100033210082031
Before Election,before_election,321,কাতার প্রবাসী সিরাজগঞ্জ এর ছেলে,কাতার প্রবাসী সিরাজগঞ্জ এর ছেলে,2,0.597256697021298
Before Election,before_election,322,বিএনপি,বিএনপি,1,0.5974677743954404
Before Election,before_election,323,ইনশা আল্লাহ ধানের শীস,ইনশা আল্লাহ ধানের শীস,4,0.8382755278707744
Before Election,before_election,324,ধানের শীষ,ধানের শীষ,4,0.7331636276891201
Before Election,before_election,325,"ভোটকেন্দ্রে যাবো, মোবাইল নিয়েই যাবো। দাঁড়িপাল্লায়, ভোট দিবো সেলফি তুলে সেলিব্রেট করবো। ভোট হবে উৎসব ইনশাআল্লাহ।",ভোটকেন্দ্রে যাবো মোবাইল নিয়েই যাবো দাঁড়িপাল্লায় ভোট দিবো সেলফি তুলে সেলিব্রেট করবো ভোট হবে উৎসব ইনশাআল্লাহ,0,0.9193832071291692
Before Election,before_election,326,চুরি করার সুযোগ দিলে নাকি সুষ্ঠু নিরপেক্ষ নির্বাচন হয়। মনের কথা বিএনপির,চুরি করার সুযোগ দিলে নাকি সুষ্ঠু নিরপেক্ষ নির্বাচন হয় মনের কথা বিএনপির,0,0.9263481079003478
Before Election,before_election,327,মা মেনে উপায় নাইরে পাগলা,মা মেনে উপায় নাইরে পাগলা,2,0.799150146758327
Before Election,before_election,328,"সারা বাংলা হয়েছে জোট, নৌকা ছাড়া কিসের ভোট।",সারা বাংলা হয়েছে জোট নৌকা ছাড়া কিসের ভোট,4,0.5766110877556848
Before Election,before_election,329,এসেছে জোয়ার এসেছে ঢেউ ধানের শীষের  বিজয় ঠেকাতে পারবে না কেউ,এসেছে জোয়ার এসেছে ঢেউ ধানের শীষের বিজয় ঠেকাতে পারবে না কেউ,0,0.4817928796101753
Before Election,before_election,330,বিএনপির মহাসচিব নির্যাত ফখরুল ইসলাম আলমগীর আগাম কথা একটু কমায় বলেন,বিএনপির মহাসচিব নির্যাত ফখরুল ইসলাম আলমগীর আগাম কথা একটু কমায় বলেন,2,0.8840291721930433
Before Election,before_election,331,বিএনপি একটা আদর্শিক গণতান্ত্রিক দল তাদের উদারত মন আছে দেশ জাতির স্বার্থে বিএনপি যে কোন জিনিস মেনে নেয় এটাকে বলে,বিএনপি একটা আদর্শিক গণতান্ত্রিক দল তাদের উদারত মন আছে দেশ জাতির স্বার্থে বিএনপি যে কোন জিনিস মেনে নেয় এটাকে বলে,1,0.9326575776964263
Before Election,before_election,332,"এই নির্বাচলে বি এন পিই জিতবে, তবে অনেক কষ্ট হবে,",এই নির্বাচলে বি এন পিই জিতবে তবে অনেক কষ্ট হবে,2,0.8388323933377306
Before Election,before_election,333,বাংলাদেশ জাতীয়বাদী দল এমন একটা দল যে কোন কিছু মেনে নেওয়ার জন্য প্রস্তুতি থাকে ইনশাল্লাহ বাংলার জনগণ যদি মেনে নেয় বাংলাদেশ জাতীয়বাদী দল মেনে নিবে ইনশাআল্লাহ যেকোন ফলাফল,বাংলাদেশ জাতীয়বাদী দল এমন একটা দল যে কোন কিছু মেনে নেওয়ার জন্য প্রস্তুতি থাকে ইনশাল্লাহ বাংলার জনগণ যদি মেনে নেয় বাংলাদেশ জাতীয়বাদী দল মেনে নিবে ইনশাআল্লাহ যেকোন ফলাফল,1,0.9568073270059291
Before Election,before_election,334,ইনশাআল্লাহ তারুণ্যের প্রথম ভোট ধানের শীষের পক্ষে হোক,ইনশাআল্লাহ তারুণ্যের প্রথম ভোট ধানের শীষের পক্ষে হোক,4,0.9106009867646313
Before Election,before_election,335,ইনশাআল্লাহ ধানের শীষ,ইনশাআল্লাহ ধানের শীষ,4,0.7996197007794654
Before Election,before_election,336,ধানের শীষ,ধানের শীষ,4,0.7331636276891201
Before Election,before_election,337,ধানের শীষ,ধানের শীষ,4,0.7331636276891201
Before Election,before_election,338,ইনশাআল্লাহ,ইনশাআল্লাহ,4,0.5976223214210143
Before Election,before_election,339,ইনশাআল্লাহ,ইনশাআল্লাহ,4,0.5976223214210143
Before Election,before_election,340,"বিজয় আমাদের হবে,,টেকনাফ থেকে তেঁতুলিয়া সমতল থেকে পাহাড়,  মার্কা মোদের একটাই ধানের শীষ দিবো ভোট ধানের শীষে, গড়বো দেশ মিলেমিশে",বিজয় আমাদের হবে টেকনাফ থেকে তেঁতুলিয়া সমতল থেকে পাহাড় মার্কা মোদের একটাই ধানের শীষ দিবো ভোট ধানের শীষে গড়বো দেশ মিলেমিশে,0,0.6248152938758338
Before Election,before_election,342,ইনশাআল্লাহ বিএনপি,ইনশাআল্লাহ বিএনপি,4,0.7291155890258156
Before Election,before_election,343,"নির্বাচন সুস্থ না হলে কারচুপি হলে নির্বাচন মেনে নিবে না জনগণ,",নির্বাচন সুস্থ না হলে কারচুপি হলে নির্বাচন মেনে নিবে না জনগণ,2,0.9103872617286364
Before Election,before_election,344,"আগামীকাল রাতে বাংলাদেশে রাতে গরু ছাগলের হাট বসবে, উক্ত গরু ছাগলরা গলায় দড়ি পড়ে রেডি থাকবেন",আগামীকাল রাতে বাংলাদেশে রাতে গরু ছাগলের হাট বসবে উক্ত গরু ছাগলরা গলায় দড়ি পড়ে রেডি থাকবেন,3,0.9104717043782946
Before Election,before_election,345,ইনশাআল্লাহ যাবে দাড়িপাল্লা কেউ ঠেকাতে পারবেনা,ইনশাআল্লাহ যাবে দাড়িপাল্লা কেউ ঠেকাতে পারবেনা,0,0.8656040256410236
Before Election,before_election,347,বিএনপি সরকার গঠন করবে ইনশাআল্লাহ,বিএনপি সরকার গঠন করবে ইনশাআল্লাহ,0,0.5396440838412262
Before Election,before_election,348,হেরে গেলে বলবে নির্বাচন সুষ্ঠু হয়নি,হেরে গেলে বলবে নির্বাচন সুষ্ঠু হয়নি,0,0.8842700206017191
Before Election,before_election,350,ভয় কাজ করছে কলিজার ভেতরে .!!,ভয় কাজ করছে কলিজার ভেতরে,0,0.7985609081307776
Before Election,before_election,351,অথচ জামায়াত আগ থেকেই সুতা ধরার পায়তারা খুঁজতেছে একটু আগে বলছে তাঁরা মানবে না,অথচ জামায়াত আগ থেকেই সুতা ধরার পায়তারা খুঁজতেছে একটু আগে বলছে তাঁরা মানবে না,0,0.86528248953375
Before Election,before_election,353,সাজানো নাটক মঞ্চস্থ হচ্ছে সেরকম মনে হচ্ছে একটি মেয়ে বলতেছে শিখিয়ে দেওয়া কথা মনে হলো।,সাজানো নাটক মঞ্চস্থ হচ্ছে সেরকম মনে হচ্ছে একটি মেয়ে বলতেছে শিখিয়ে দেওয়া কথা মনে হলো,3,0.9101389383364771
Before Election,before_election,354,"বই, এন, পি, এবার জিতবে ইনশাল্লাহ",বই এন পি এবার জিতবে ইনশাল্লাহ,2,0.8638935794325255
Before Election,before_election,355,ইনশাল্লাহ জয় হবে ধানের শীষের জয় হবে,ইনশাল্লাহ জয় হবে ধানের শীষের জয় হবে,4,0.8664571071429861
Before Election,before_election,356,জনাব তারেক রহমান এর হাত ধরে বাংলাদেশ এগিয়ে যাবে,জনাব তারেক রহমান এর হাত ধরে বাংলাদেশ এগিয়ে যাবে,4,0.9100030169207992
Before Election,before_election,357,"চাঁ দা বা জি র টাকা দিয়ে বস্তির মানুষকে বাসস্থান করে দেওয়ার আশ্বা'স দিচ্ছে, সে নিজেঔ চলে চাঁ দা র টাকা দিয়ে, আবার মানুষকে দেওয়ার প্রতিশ্রুতি দিচ্ছে",চাঁ দা বা জি র টাকা দিয়ে বস্তির মানুষকে বাসস্থান করে দেওয়ার আশ্বা স দিচ্ছে সে নিজেঔ চলে চাঁ দা র টাকা দিয়ে আবার মানুষকে দেওয়ার প্রতিশ্রুতি দিচ্ছে,0,0.9492991317922839
Before Election,before_election,358,"এই তো জিয়ার ছেলে,,,অল্পতেই সাধারণ মানুষের সাথে মিশে যান,,",এই তো জিয়ার ছেলে অল্পতেই সাধারণ মানুষের সাথে মিশে যান,0,0.501098719846021
Before Election,before_election,359,দেখা যাক কি হয়,দেখা যাক কি হয়,3,0.400512338294007
Before Election,before_election,360,In sha allah,in sha allah,0,0.5999840133558105
Before Election,before_election,361,বট বাহিনীর বেহেস্তের টিকিট শেষ হয়ে যাচ্ছে।,বট বাহিনীর বেহেস্তের টিকিট শেষ হয়ে যাচ্ছে,3,0.8644148943839906
Before Election,before_election,362,২০০১-২০০৬ পর্যন্ত অসীম দুর্নীতি ভুলে নাই জাতি,পর্যন্ত অসীম দুর্নীতি ভুলে নাই জাতি,0,0.8646941747120401
Before Election,before_election,363,বিএনপি,বিএনপি,1,0.5974677743954404
Before Election,before_election,364,রাজনৈতিক মুক্ত পেইজ স্বাগতম আপনাকে,রাজনৈতিক মুক্ত পেইজ স্বাগতম আপনাকে,2,0.5711435504447128
Before Election,before_election,365,ইনশাআল্লাহ বিজয় সুনিশ্চিত,ইনশাআল্লাহ বিজয় সুনিশ্চিত,4,0.5511831309136525
Before Election,before_election,366,ধানের শীষ,ধানের শীষ,4,0.7331636276891201
