Comment,Location 1,Location 2,Location 3
ভেঙে দেওয়া হলো অন্তর্বর্তী সরকার রাজনৈতিক অঙ্গনে নতুন মোড়—সরকারি সিদ্ধান্তের পর আনুষ্ঠানিকভাবে অন্তর্বর্তী সরকারের কার্যক্র…,Dhaka,,
ধন্যবাদ,Dhaka,,
ওনার চেহারা টা দেখলেই ঐযে ঠেলাঠেলি করেছিলো এটার কথা মনে পড়ে । ওনাকে প্রতিমন্ত্রী দিছে কারন উনি ঠেইললা যুদ্ধ করতে পারে তাই,Comilla,,
খুব সুন্দর সাজানো গোছানো,Dhaka,,
এগিয়ে যান ভাই,Dhaka,,
Manush kuje painai,Chattogram,Chittagong,Rajshahi
মাত্র ২০০ টাকা কেজি,Dhaka,,
ছোট আইডি সবাই একটু সাহায্য করবেন যেন বড় কিছু করতে পারি …,Dhaka,,
বাংলাদেশ জাতীয়তাবাদী সাইবার দল নাটোর জেলা শাখার পক্ষ থেকে প্রানঢালা শুভেচ্ছা ও অভিনন্দন শুভ কামনা অবিরাম …,নাটোর,Natore,
সবাই হাহাহা দিচ্ছে কেন,Dhaka,,
Kopal,Chittagong,,
মুক্তিযোদ্ধা সার্টিফিকেটটাও দিয়ে দেওয়া হোক,Dhaka,Barguna,
Oni Abar kon muktijota,Dhaka,,
ঘেরাও চলবে,Dhaka,,
উনি মুক্তিযুদ্ধের কি বুঝবে? বুঝলাম না। খেলা ধুলা তে দিলে ভালো হতো।,Dhaka,,
অসাধারণ!,Dhaka,,
নব্য আ.লীগের উত্তরাধিকার ভিত্তিক মুক্তিযুদ্ধার জন্ম হবে!,Dhaka,,
ধাক্কাধাক্কি বিষয়ক মন্ত্রী তে দেন,Khulna,,
এই ও দেখা লাগলো বাঙালির,Khulna,,
সেই পেটে থাকতে যুদ্ধ করছে এই বেডায় ভাবা যায়! এর লাইগাইতো এই মন্ত্রণালয় পাইছে,Barisal,,
সংসদে যেমন দেরি করে গেছে এদেশে কোনো যুদ্ধ লাগলে তার নির্দেশ যদি এমন দেরি করে দেয় তাহলে তো খেল খতম,Dhaka,,
একে মন্ত্রনালয়ে মানায় না একে মানাই জোর করে ক্ষমতা নেওয়ার আন্দোলনে,Dhaka,,
হেতেনের জন্ম শুক্কুরে শুক্কুরে আট সে মুক্তিযোদ্ধা মন্ত্রী হয় কেন কিভাবে?,Barisal,Chandpur,
জনাব ২০২৮ সাল পর্যন্ত ইনশাআল্লাহ,Dhaka,,
এ কি মন্ত্রী হবার যোগ্য?,বগুড়া,ময়মনসিংহ,Dhaka
মুক্তিযুদ্ধ কি উনি কি এটা জানে.?,Dhaka,,
এহন সবাই বইয়ে জিয়া পরিবারের মুক্তিযুদ্ধের ইতিহাস পড়বো,Dhaka,,
ঘেরাও করে মুক্তিযুদ্ধে সফল হয়েছিল বাংলাদেশ,Tangail,,
কাচা কাজ হয়েছে,সিলেট,Sylhet,Habiganj
ফজলু পাগলাম হয়ত ডায়রিয়া হয়েছে তাই...,সিলেট,Sylhet,
ক্রীড়া বিষয়ক মন্ত্রী উপমন্ত্রী দেয়নি শুকরিয়া।,Chittagong,,
ঠোটে লিপস্টিক কম হয়েছে আরএকটু হলে সুন্দর লাগতো,Dhaka,Gazipur,Sirajganj
"""বিগত ১৬ বছরে আওয়ামী লীগের অত্যাচারে বিএনপির সাধারণ সমর্থক, নেতা কর্মী ও তাদের পরিবার অনেক কষ্ট করেছে। এমনকি বিএনপি জাসাস যুবদ…""",Dhaka,,
Tar birodde j kico bolbe ee.. Akta rajakar,Narayanganj,,
বিষয়টা হচ্ছে কিছু না কিছু তো দিতেই হবে না হলে তো নিজে নিজেই বা মন্ত্রী হয়ে যাবে,Sylhet,,
লাগারে লাগা সোয়াবিন লাগা......,Dhaka,,
এখন হালা হুমন্দি সব হয়ে যাবে মুক্তিযোদ্ধা,Dhaka,Chittagong,Noakhali
"""মাথায় গিলু,ই পদে এর থাইকা ফজা পাগলাই ভালো ছিল""",Sylhet,Habiganj,
ফজু পাগল কে দিলো না কে,Dhaka,,
মুক্তিযোদ্ধা ইশরাক হোসেন,Dhaka,Narsingdi,
ব্রেইন ছাড়া ইশরাক,Sylhet,,
ভাবছিলাম বিএনপি ২ বছর টিকবে এখন দেখি ১ বছর ও পারবে না,Dhaka,,
বাবার মুক্তিযুদ্ধের কোটায় ছেলে নিয়োগ।,Dhaka,Barisal,
স্যালুট বীর মুক্তিযোদ্ধা ইশরাক হোসেন কে,Dhaka,,
শুভ বুধবার। …,Chittagong,Chandpur,
গেয়ি ভ্যাস তেল লেনে,Dinajpur,,
নগর ড্যাডি বিষয়ক মন্ত্রনালয় দিলে ভাল হবে,বরিশাল,Dhaka,Barisal
Akhon r dhakka dhakki korte hbe nahh.....amni seat raikha dbe,Mymensingh,Sherpur,
বীর মুক্তিযোদ্ধা ইশরাক ভাই,Dhaka,Tangail,
এই পোস্ট দেখার পর জিবন যুদ্ধেই হেরে গেলাম,Dhaka,Sylhet,Gazipur
নতুন চেতনা লোডিং....,Dhaka,,
ধাক্কাধাক্কি মন্ত্রি দিলে ভাল হইত,Dhaka,,
আহ্,Dhaka,Kishoreganj,
জনতার মুক্তিযোদ্ধা,Dhaka,,
উস্তাদ,Chittagong,Chandpur,
ধাক্কায় কাজ হয়েছে,Khulna,,
নগর ডেন্ডি,Chittagong,,
Fojlur rohman ke banano drkar chilo,Dhaka,Barisal,
মালঞ্চি,Dhaka,Jamalpur,
যারা মুক্তিযোদ্ধা তাদের কে মুক্তিযোদ্ধা বিষয়ক মন্ত্রী না দিয়ে শিশু কে দেই,Dhaka,,
অভিনন্দন আমাদের গর্ব বাংলাদেশের মাটি মানুষের নেতা শুভকামনা রইল,Jamalpur,,
তারেক রহমান জামাতের আমিরকে মন্ত্রী বানাবেন আর জামাতের আমি এর সাথে তা....See,Mymensingh,,
"""হইছে, এইবার পুরাদমে স্বাধীনতার চেতনা পাইকারী হারে বিক্রি হবে।""",Dhaka,,
সমস্যা নাই ভাই। পুরো পৃথিবী আপনার বিপক্ষে থাকলেও আমি পৃথিবীর পক্ষে।,Dhaka,Kishoreganj,
"""হইতে চাইছিলাম মেয়র, বানাইলেন প্রতিমন্ত্রী।""",Tangail,,
পাগলারে দিছে আরো চেতাইয়া,Chittagong,Lakshmipur,
Onake amar protimonti dile valo hoy.,Dhaka,Barisal,Bhola
মুক্তিযুদ্ধ বিষয়ে ইশরাক কী জানে? ওর বয়স কত? বিএনপি নাকি স্বাধীনতার দল? একজন মুক্তি যোদ্ধা নেই এই মন্ত্রণালয়ের জন্য???,Chittagong,,
মুক্তিযুদ্ধ মানেই জাতির ড্যাডি বঙ্গবলটু আর নগর ড্যাডি ইশরাক,Dhaka,,
Muktijuddho bishoyok montri Thela-theli bishoyok montri️,Sylhet,Sunamganj,
আরো বেশি করে ভোট দেও বাঙালি জাতি,Dhaka,Narsingdi,
সামলাতে পারবে গায়ের জোর আসে না,Panchagarh,,
মেথর,Chittagong,Sylhet,
ওর জন্য এটা অতিরিক্ত হয়ে গেছে!,Dhaka,,
How,Dhaka,Netrokona,
সাওয়া মন্এী,Chittagong,Comilla,
"""দুঃখের বিষয় হচ্ছে তার বাবার সাথে যে রাজনীতি করেছে সে কিন্তু মন্ত্রীর মর্যাদা পেল না, বাংলাদেশে ছয়বার এমপি জয়নাল আবদীন ফারু…""",Chittagong,Noakhali,
ভাই তার আব্বা যুদ্ধ করছে নি আমার কাছে সন্দেহ হয়,Dhaka,,
আরে তোমরা তো জানোই না আমি আর ও এক সাথে যুদ্ধের মালামাল সরবরাহ করছি।,Dhaka,,
একদম ঠিক আছে,Dhaka,,
"""মন্ত্রণালয় যদি না দিত, তিনি পাঁচ ে সংসদ ঘেরাও কর্মসূচি দিয়ে নিজে নিজেই মন্ত্রীর শপথ পড়ে ফেলতেন!""",Dhaka,Chittagong,Gopalganj
দেশটা চাঁন্দের দেশে চলে গেছে মনে করেন আর কিছু বাকি নাই।,Dhaka,Barisal,Pirojpur
বয়স কম,Chittagong,,
এই দেশ তাইলে শেস কটি মানুষের প্রান চলে গেলেও এই দেশ কখোনো ঠিক হবে না,Dhaka,Noakhali,
সুধু মন্ত্রী পদ দিলে হবে না ঠেলাঠেলি জন্য ওকে নোবেল দিতে হবে তারেক ভাই,Dhaka,,
মেয়র সাহেব,Feni,,
কামড়াকামড়ি করে সমনে এগিয়ে যাবে,Dhaka,,
ইতা মুক্তযুদ্ধের ইতিহাসও জানে না।তারে একটা GK বই গিফ্ট করতে চাই,চট্টগ্রাম,কক্সবাজার,Chittagong
কেমনে কি? সে কি মুক্তি যুদ্ধ বিয়ষ কিছু বুঝে।,Chittagong,Bandarban,Cox's Bazar
আর জাকে ধর্ম মন্ত্রী করা হয়েছে তার সর্বোচ্চ শিক্ষাগত যোগ্যতা SSC সব আমাদের হাতের কামাই,Dhaka,,
Rifat Hossain Rahat Rayhan Islam ei dek hala baji dhorsili nh,Dhaka,Patuakhali,
খেলার সময় বাচ্চাদের দুধভাত করে রাখার যে ব্যাপারটা,Dhaka,Gazipur,
Keno?,Dhaka,Khulna,Jessore
Ekhon oi bolbe tarek rahaman ow juddo korse,Cumilla,Comilla,
দেশটার হোগামারা কমপ্লিট,Dhaka,,
hagar montri.khusir thelay haha astase,Narayanganj,,
সংবিধান অনুযায়ী বাংলাদেশের ১৩তম জাতীয় সংসদ নির্বাচনের যেহেতু কোনো বৈধতা নেই অর্থাৎ ২০২৬ সালের জাতীয় সংসদ নির্বাচন অবৈধ সুতরাং …,Dhaka,,
"""ভাগ্য ভালো দলের সিদ্ধান্তে হয়েছেন, নয়তো নিজে নিজেই মন্ত্রিত্বের শপথ নিতেন.!""",Gazipur,,
হয়চে না ইয়াং বেডা রে কি দিসে,Dhaka,Mymensingh,
Ai bar juddho lagboi,Dhaka,Barisal,Bhola
ঘেরাও কমিটির প্রধান,Dhaka,,
এসব কিয়া দেখতাহে,Dhaka,,
মুরগি যুদ্ধা,Comilla,,
আস্তা একটা ভ'কলম,Dhaka,,
যার নাই মেয়র এর কাজ সম্পর্কে ধারনা আজ সে মন্ত্রণালয় চালাইবো,Dhaka,,
জোকার,Dhaka,Mymensingh,
রিমিনি এডিট,Barisal,,
Ei halare keno jeno amr kache neshakhor mone hoy,Chittagong,Chandpur,
Ore dekhle hashi ahe Amar,Dhaka,,
মুক্তিযুদ্ধের চেতনায় এখন আর ঘুমানো যাবেনা,Rajshahi,,
নয়ন রে দৌড়া দৌড়ি মন্ত্রী বানানো হোক,Dhaka,,
1987 সালে জন্ম হওয়া মানুষটা 71 এর মুক্তিযুদ্ধের কি বুঝবে বুঝে আসেনা।,Dhaka,,
শেষ,Dhaka,,
একেবারে জায়গা মত দিছে তার মতো যোদ্ধা একটাও নাই বি এন পি তে কয় আগেও হেতারে দেখলাম যুদ্ধ করতে শহিদ মিনারে,Bagerhat,,
ঘেরাও উপদেষ্টা ।,Dhaka,Faridpur,
বয়স হয় নাই ৪০ দিয়া দিছে মুক্তিযোদ্ধা বিষয়ক হো***সারা আকাশ ভরা তারা..!,Dhaka,,
"""২য় পলক ।হোগামা,,,,,,,,রা সারা""",Chittagong,Barisal,
Chor rey churi korar pod disey,Dhaka,Tangail,
আলহামদুলিল্লাহ। মুক্তিযুদ্ধের স্বপক্ষের লোক।,ঢাকা,Dhaka,
Gaja kheye pod dise mone hocche,Dhaka,Cox's Bazar,
"""কিছু পর হবে """"বীর মুক্তিযোদ্ধা ইসরাক হোসেন """"""",Dhaka,,
আমার মনে হয় তার জন্ম আগে যুদ্ধ হয়েছে,লালমনিরহাট,Lalmonirhat,
"""ঠেলঠেলি যোদ্ধা,,,""",Dhaka,Rangpur,
Kon sector লড়ায় করচে সে শেখ হাসিনা তো বলতো বি এন পি কে রাজাকার,Dhaka,,
২ বছর ও টিকবে নাকি সন্দেহ,Dhaka,,
আচ্ছা এ মন্ত্রনালয়ের কাজ কি?,Khulna,,
প্রধানমন্ত্রী - লন্ডন | স্বরাষ্ট্র - ভারত | পররাষ্ট্র - আমেরিকা |…,Dhaka,,
"""কয়েক পরে মনে হয় নতুন করে মিডিয়া প্রকাশ করবে, বীর মুক্তিযোদ্ধা """"ইশরাক হোসেন """"""",Dhaka,,
না ঠিক ই আছে সব জায়গায় তো যুদ্ধ ই করে হালায়,Chittagong,,
সবারই খাওয়ার অধিকার আছে। বেচারাকে দেওয়ার জায়গা ছিল না তাই সেখানে দেওয়া হয়েছে,Dhaka,,
এই পুষ্ট দেখার পর আধা হাসছি,Sylhet,,
ওওমাকালো,Dhaka,,
শেষ যুদ্ধ টা রে ও খাইয়া দিবে,Dhaka,Kishoreganj,
ওর দাদা দেখেছে মুক্তিযুদ্ধ? ওকে দিছে মুক্তিযুদ্ধ মন্ত্রনালয় এর দায়িত্ব,Dhaka,,
মুক্তিযোদ্ধার হোগামারা সারা,Khulna,Bagerhat,
Or vhason er speech sunle jei freedom fighters ra becha ase shock kheye more jba,Dhaka,,
"""কয় পরে সেও জাতির কাছে বলবে, সেও ৭১ রে যুদ্ধ করেছে""",ময়মনসিংহ,Dhaka,Mymensingh
খেলা হবে নিরাপদে,Rangpur,,
nogor daddy,Rajshahi,,
এই কি মুক্তিযোদ্ধা? না,Dhaka,Naogaon,
Does he know anything about liberation war????!,Dhaka,,
"""ও মুক্তিযুদ্ধের সময় জন্মেছিলো,???""",Dhaka,,
শান্তি চুক্তির পুরো পুরী ওলঙন করছে বিএমপি,Dhaka,,
নতুন ভাবে নাতি পুত্রের সৃষ্টি হবে,Chittagong,Rajshahi,
কাউকে খাওন থেকে দূরে রাখা যাবে না,Dhaka,,
রাম পাঠা,Dhaka,,
মেয়র হতে পারে না এখন এক ঠেলায় থাকবো মন্ত্রী জয় বাংলা খেলা হবে রাজপথে।,Dhaka,Chandpur,
কারে কি দিছে রে ভাই,Narayanganj,,
কিন্তু ইশরাক শপথ ই তো নিলো রাজাকার দের সাথে।,Tangail,,
১৯৭১ সালে জিয়াউর রহমানের সাথে থেকে মুক্তিযুদ্ধ করছে কমান্ডো ইসরাক হোসেন,Dhaka,,
"""বাবার নাম টা ডুবাইলো,,""",Dhaka,Khulna,Satkhira
দুইজন বীরশ্রেষ্ঠদের নাম জানে কি না সন্দেহ,Khulna,,
অথচ প্রশ্ন করেন ৭ জন বীরশ্রেষ্ঠের নাম কি তার উত্তর কি দেয় দেখেন৷,Dhaka,,
মানে কোনোরকম একটা পতাকাবাহী গাড়ী পেলেই হলো!,Dhaka,Kishoreganj,
এবারে এই মন্ত্রনালয় হবে হজবরল,Barisal,,
"""কমেন্ট পড়ার অভ্যাস টা ছাড়তে পারলাম না, এমন ভাবে কমেন্ট পড়ছি যেন কমেন্ট পরীক্ষায় আসবে""",Dhaka,,
৭১ সালের সেক্টর কমান্ডার ছিল মনে হয়।,Chittagong,Lakshmipur,
এটা হওয়ার কথা ছিল ভাগ্য ভাল হলে সে তার নাম মুক্তিযুদ্ধের কোনো এক সেক্টরে লিখে নিবে,Chittagong,,
ঠ্যালার জোর আছে মানতে হবে,Dhaka,,
নগর ড্যান্ডি এইবার স্বাধীনতার বারোটা বাজাবে,Dhaka,Rangpur,
যোগ্যতা কোন বিষয় নয় দলের ভিতরে সব মন্ত্রী রাখতে হবে,Chandpur,,
অভিনন্দন,Dhaka,,
চেতনা,Dhaka,Chittagong,Lakshmipur
লেদা পোলারে দিছে কি এটা,Dhaka,,
অনুষ্ঠানে ধাক্কাধাক্কি নিয়ন্ত্রণ বিষয়ক মন্ত্রী দিলে নিজেই কিছুটা সংশোধন হতো আর কি।,Chittagong,,
ALHAMDULILLAH BLESS YOU DEAR UNCLE,Dhaka,,
এখানে ফজলুর হলকে দিলে ভালো হত,Dhaka,,
মুক্তি যুদ্ধ ভাতা পাবে বহু দলীয় মুক্তি যুদ্ধা।,Dhaka,Chittagong,
২৪ বছরের ছেলেরা এবার ভাতা নিবে,Dhaka,Dinajpur,
মাননীয় মন্ত্রী মহোদয় লীগ সরকারের আমলে দেওয়া ভুয়া মুক্তি যোদ্ধাদের সনদ বাতিল করবেন কি?,Comilla,,
এটা কোন কথা অনেকের পদ গুলো তাদের ক্যারেক্টার এর সাথে যায় না যেমন সালকুম একজন আর একজন ইনি কোনো কথা এটা,Dhaka,,
ইনকাম শুরু,Dhaka,,
বয়স কি হয়ছে তার মুক্তিযুদ্ধ বিষয়ক প্রতিমন্ত্রী দিসে??,Dhaka,Mymensingh,
এখন সে বলবে যুদ্ধের ঘোষণা আমি দিছিলাম …,Dhaka,Gazipur,
ফজু কই,সুনামগঞ্জ,Dhaka,Sunamganj
সবাই দেকে জান,Dhaka,,
জয় বাংলা,মানিকগঞ্জ,Dhaka,
পাদ হাগু বিষয়ক মন্ত্রনালয় দিলে ভালো হতো,Dhaka,,
ফি আমানিল্লাহ্,Dhaka,,
Asif mahmud er khobor ase,Dhaka,,
ওকে নিজে নিজেই ঘোষণা দিয়ে দিল। না এই অভ্যস্ত তারা আছে।,Dhaka,,
"""“ফলো মানে নতুন সম্পর্কের শুরু, আর কমেন্ট মানে সেই সম্পর্ককে সুন্দরভাবে ধরে রাখা।…""",Dhaka,,
হাসুন প্রাণ খুলে,Dhaka,,
এতে মুক্তি যোদ্ধার কী বুঝে!!,Dhaka,Comilla,
Bangladesh is planning to go back 50 yrs..,Dhaka,,
ইশরাক ভাইকে এই মুহুর্তে শিশু বিষয়ক মন্ত্রনালয়ের দায়িত্ব দিলে ভালো হত।,Dhaka,Faridpur,Rajbari
গেরাও বিষয়ক প্রতিমন্ত্রী হলে ঠিক আছে,Comilla,,
তালা বাবা।,Brahmanbaria,,
এর বয়স কতো জানি,Chittagong,,
"""কাম সারছে মন্ত্রণালয় আর মন্ত্রণালয় থাকবে না, হবে হজবরল""",Dhaka,,
খতম টা টা বাই বাই,Dhaka,Bagerhat,
যেখানে মুক্তি যুদ্ধের ক টাও বুঝে না,Panchagarh,,
এবার কি আরো মুক্তিযোদ্ধা বাড়বে?,Rangpur,Dinajpur,
ঠেলাঠেলি বিষয়ক মন্ত্রী,Dhaka,,
শিশু মুক্তিযুদ্ধা,সিলেট,Dhaka,Sylhet
"""Vai, hasar ki hoylo bujlam na , badar ki rop nai , na Gon nai.bujlam na""",Dhaka,,
হে মুক্তিযুদ্ধের কিতা বুঝে,সিলেট,Sylhet,Sunamganj
ওর বয়স কত,Chittagong,,
"""নিজের চ্যানেল বলে কথা, সব কিছু অ্যাডভান্স লেখে দেওয়া যায়,""",Dhaka,Chandpur,
হাসি পায়,শরীয়তপুর,Dhaka,Shariatpur
এতো হাহাহা রিয়েক্ট কেন..?,Dhaka,Jamalpur,
Faaaahhhh,Dhaka,,
crickete thaka ta bhalo,Dhaka,,
what the heeellllll,Dhaka,,
পৌতৃক কোটা,Feni,,
ডাইপার,সিলেট,Sylhet,
ইশরাক জন্মের আগে কি কখনো মুক্তিযুদ্ধ দেখছে?,Dhaka,,
এই কি মন্ত্রনালয় চালাতে পারবে?,Chittagong,,
ok,Dhaka,,
দুই পর দেখবো মুক্তিযোদ্ধার লিস্টে হেতার নাম হেতে মুক্তিযুদ্ধ বিষয়ক পুরস্কার পাইবো,Comilla,,
মেতর,Dhaka,Chittagong,
হালা,Dhaka,,
উনি না মেথর স্যারি মেথর হবে,Dhaka,,
এবার কাকে ঘেরাও দিবে?,Dhaka,Rajshahi,
যাইহোক এই মন্ত্রণালয়ের কেও ঘেরাও দিতো না তিনি,Rajshahi,,
অযোগ্য লোকজন কে এই সব কাজ দিচ্ছে কেনো,Chittagong,Lakshmipur,
হাদা মোখ মাফি,Sylhet,,
তার জন্ম ১৮০০ সালে সেজন্য সে মুক্তিযুদ্ধ বিষয়ক মন্ত্রী,Lalmonirhat,,
Joker of the ministry,Dhaka,Pabna,
এইবার অরজিনাল মুক্তিযুদ্ধা দের খবর আছে,ঢাকা,Dhaka,Munshiganj
মুক্তিযুদ্ধের ***,Dhaka,Sirajganj,
হো*-/গা মারছে,Dhaka,,
এইসব রাজাকারকে কী সব দায়িত্ব দেওয়া হইছে মুক্তিযুদ্ধ কী সে কী তা বোঝে,রাজশাহী,Rajshahi,
কাদেরের হোগামারা সারা,Dhaka,Bagerhat,
ঠেলা ঠেলি যুদ্দা,Chittagong,,
সার্কাস,Habiganj,,
