Comment,Location 1,Location 2,Location 3
[সন্দেহজনক লিঙ্ক সরানো হয়েছে]...…,ঢাকা,Dhaka,
"""ওখানে ধরা খাবে তারপর সরকারিভাবে দেশের কারাগারে আসবে, দেশের আদালত মুক্ত করে দিবে। এটাই পলিটিক্স।""",Dhaka,Gazipur,
"""এভাবেই ফেরত আসবে,এটাই পলিটিক্স""",Dhaka,,
দেশে পাঠানোর একটা বৈধ প্রক্রিয়া মাত্র...,Dhaka,Rajshahi,Gazipur
এটা দেশে প্রবেশের একটি প্রক্রিয়া মাত্র,Dhaka,Pabna,
"""এখন থেকে প্রায়ই শুনা যাবে গ্রেফতারের খবর,,, ভারত সরকার এখন আর সাধারণ কর্মীদের তেমন গুরুত্ব দিবে না --- যারা পালিয়ে গেছে তাদের …""",Dhaka,,
বাংলাদেশের জেল থাকতে অন্যদেশের জেলে থাকবে কেন..?,Dhaka,,
এটা একটা রাজনৈতিক চাল হতে পারে,Panchagarh,,
ভারত কি তাহলে আওয়ামী লীগের সাথে পল্টি নিলো,Dhaka,,
বিএনপির কাছে ভালো হওয়া আরকি।। তবে এরা ভিতরে ভালোই থাকবে কারণ ভারত হচ্ছে উমিচাঁদ এ…,Dhaka,Faridpur,
আরও কিছু দেখার অপেক্ষায় রইলাম,ঢাকা,ব্রাহ্মণবাড়িয়া,Chittagong
ধন্যবাদ জানাই,Tangail,,
খাইছে রে..,মৌলভীবাজার,Sylhet,Moulvibazar
এটা ভালো,Dhaka,,
সম্ভবত ওদের খরচ করার মতো টাকা পয়সা শেষ,রাজশাহী,Rajshahi,Cox's Bazar
শুরু হয়ে গেল নাকি ধরপাকর। ভারত সরকার কি মেসেজ দিতে চাচ্চেন বাংলাদেশের জনগনকে।,Kurigram,Panchagarh,
এগুলোকে এখন গ্রেফতার করবে আর আস্তে আস্তে সবগুলোকে বাংলাদেশ প্রেরণ করবে,Sylhet,,
"""হাসিনার তো ভিসা পাসপোর্ট কিছুই নেই, তবুও এখনো ভারতে আছে কীভাবে?""",Dhaka,Gazipur,
তাদের আর শান্তি নাই,Dhaka,,
নিজ দেশেও (ভারত) নিরাপদ নয় আওয়ামীলীগ,Chittagong,Noakhali,
শুরু হয়েছে একে একে সবাই ধরা পড়বে,Dhaka,Mymensingh,
নিজ নাগরিকদের কেউ এভাবে গ্রেফতার করে?,Dhaka,,
কাগজ নেই তাই দরছে এটা নিয়ে এত লেখালেখির কি আছে।,Dhaka,,
খেলা শুরু এভাবেই চলবে,Barisal,Narayanganj,
Beimani korlo,Chandpur,,
লে হালুয়া,খাও হালুয়া,রংপুর,Dhaka
"""পলাতক এইসব নেতাকর্মী( আঃলীগ) ও এই দেশের ভিতর থেকে একটি সম্প্রদায়ের কিছু লোক, ভারত কে বার বার অনুরোধ ও আহ্বান জানাচ্ছিল ছিল যে…""",Kurigram,Panchagarh,
"""নাটক কইরে দেশে পাঠাবে, পাকড়াও দেখায় খালাশ। মাঝখানে কিছু টাকার ছড়াছড়ি!""",Khulna,Bagerhat,
"""এভাবেই নিরপেক্ষ, সহজ সরল, সঙ্গিত-মনা, সুশীল, ছেতনাবাজ.. মানুষ গুলো দেশে ফিরে আসবে""",গাজীপুর,Dhaka,Gazipur
"""তোদের ওয়েবসাইট এ্যাড দেখানোর জন্যেই বানানো, নিউজ লিখার কী দরকার? বলে দে, এ্যাড দেখে আসুন।""",মৌলভীবাজার,Sylhet,
বাংলাদেশ ক্রিকেট টিম ভারতে না যাওয়াই কি তাদের অপরাধ?,Dhaka,,
দেশে আনার ব্যবস্থা করতে হবে তাড়াতাড়ি,Chittagong,,
কোথায়ও কেও নেই,Dhaka,Rajbari,
থেরাপি দেয়া হোক.!,Dhaka,Mymensingh,Jamalpur
আলহামদুলিল্লাহ,Chittagong,,
আওয়ামী লীগ ভারত গ্রেফতার হবে? এটা মিছা কথা।,Dhaka,,
লে হালুয়া,Dhaka,,
ধরা দিয়েছে দেশে আসার জন্য,Dhaka,Mymensingh,
নাটক,Dhaka,,
এবার এদের দেশে ফিরিয়ে পুনরায় চাঙ্গা করা হবে,ঢাকা,,
"""বিগত ১৬ বছরে আওয়ামী লীগের অত্যাচারে বিএনপির সাধারণ সমর্থক, নেতা কর্মী ও তাদের পরিবার অনেক কষ্ট করেছে। এমনকি বিএনপি জাসাস যুবদ…""",Dhaka,,
দ্রুত দেশে পাঠিয়ে দেওয়া হোক,Dhaka,,
প্রধানমন্ত্রী শেখ হাসিনা এই ব্যাপারে দ্রুত পদক্ষেপ নিবেন। ঐ পুলিশ সদস্যদের খাগড়াছড়ি রাঙ্গামাটি বদলি করা হবে।,Dhaka,Narayanganj,
বহুত লবা ফালাইছে।,Jamalpur,,
লে হালুয়া,Dhaka,,
সাবাস,Dhaka,Narsingdi,
"""এটা মিথ্যা খবর,,""",Dhaka,,
এটা আবার কোন নাটক,Dhaka,Barisal,Patuakhali
না জানি কোন আকাম-কুকাম করছে,Dhaka,Gazipur,Tangail
হাস্যকর কলকাতা যাদের মামার বাড়ি তারা আবার গ্রেফতার হয়,Dhaka,Kurigram,
Please send them to Bangladesh with guard of honour. Kallu with recieve them with garlands....,Dhaka,,
What a drama!!!,Dhaka,,
Pida halago....,Dhaka,,
এত সেইফ ছিল। এখন দেখা যাবে ?,Chittagong,Comilla,
কলিকাতায় ও শুরু করেছে গ্রেপ্তার।,Dhaka,Chittagong,
কি আইলো,Sylhet,,
চমৎকার নিউজ,Dhaka,Gazipur,
এখন তো মাএ শুরু খেলা খালি দেখবা যত স্বার্থ ছিল তোত আওয়ামী লীগ কে ব্যবহার করছে এখন আওয়ামী লীগ খমতায় নাই এখন আর আওয়ামী লী…,Dhaka,,
"""বর্তমান মান সরকার কে তেল মারতেই হইতো,আওয়ামিলীগ এর কর্মিদের গ্রেপতার করছে।কতো বরো বেইমান এই ভারত দেখেন।""",Dhaka,,
এরা বাংলাদেশী হলেও এরা মূলত ইন্ডিয়ান,Dhaka,Chittagong,Bhola
হাদির খুনিদের ধরে ফেরত দে,Dhaka,,
চুদলিংপং,Dhaka,Narsingdi,Brahmanbaria
মোহাম্মদ মনির হোসাইন সব দিকে অন্ধকার,Dhaka,,
আজম মোল্লা আবার কোথাকার কিসের শিল্পী?,Dhaka,,
সবাই ধোকাবাজ,Dhaka,Pabna,
"""তাদেরকে """"র"""" এর ট্রেনিং দিয়ে দেন""",ঢাকা,সুনামগঞ্জ,
বাংলাদেশ শিল্পকলা একাডেমিতে বাউল দলে কিছু ভন্ড আছে ওই ভন্ডদের কে আইনের আওতায় আনতে হবে,Lalmonirhat,,
কলকাতা ও যদি জায়গা না হয় তো কই যাবে,Dhaka,Gazipur,
ভারত এখন তাদের গ্রেফতার করে বাংলাদেশে পাঠাবে আর ভারতের দালাল তারেক জিয়া তাদেরকে বাংলাদেশ মুক্ত করবে এটাই হচ্ছে plan,Dhaka,Rangpur,
ভালো সংবাদেই কেন সবথেকে বেশি মানুষ হা হা দেয়! বুঝিনা ব্যাপারটা,Dhaka,,
দুই পর দেখবো মুক্তিযোদ্ধার লিস্টে হেতার নাম,Dhaka,,
কোনকিছু পরার আগেই শুধু উনার ফেইস দেখে হা হা রিয়েক্ট দিয়ে দেওয়ার যে বেপারটা,Sylhet,,
এরে দেখলে হাসি পায় ক্যান?,Dhaka,,
------- যোগ্যতা বিষয় না …,Dhaka,Mymensingh,
এক ধাক্কায় এতদুর,পাবনা,Dhaka,Rangpur
সে যুদ্ধের সময় তার বাবার পেটে লিকুইড ফর্মে ছিলো। তাই তাকে একজন লিকুইড মুক্তিযুদ্ধা বলা যায়।,Chittagong,Brahmanbaria,
মানুষ এত পরিমাণ হাসি কেমনে হাসতে পারে,Chittagong,,
আমি জানিনা কেন জানি এই পোস্ট দেখার পর অটোমেটিক মুখে হাসি চলে আসছে,Dhaka,,
জুলাই যুদ্বে কি ভেসে এসেছে?,Chittagong,,
যাইহোক এই মন্ত্রণালয়ে কেও ঘেরাও দিতো না,Dhaka,,
"""সময়মত সংসদে পৌছাতে না পারা ছেলেটাও এখন মন্ত্রনালয় চালাবে, ভাবা যায়""",নীলফামারী,Dhaka,Nilphamari
সেরা,Dhaka,,
ও কি মন্ত্রী হওয়ার যোগ্য?,Sylhet,Habiganj,
সবাই এত খুশি হইছে যে সবাই হা হা করতেছে,Dhaka,Barisal,
এক ঠ্যালায় এতো দূর,Barisal,Pirojpur,
ঘেরাও বিষয়ক মন্ত্রী,Dhaka,,
"""যায়গামত দিছে বিম্পি সঠিক যায়গা সঠিক মাল, এবার মুক্তিযুদ্ধ নতুন ভাবে লিখা হবে""",Dhaka,Mymensingh,
ফুলের তোড়া দিতে আর ধাক্কা ধাক্কির প্রয়োজন নেই!,Dhaka,Sylhet,
দেশের হোগাম্রা শেষ...,Dhaka,,
প্রথমে চোখ পড়তেই প্রতিবন্ধী পড়ে ফেলছিলাম,Chittagong,,
Ai halare muktijuddhobisoyok dilo kon akkel e .onno montri hisebe dile mana jaito . advocate fazlur saheb k dile valo hoito:) …,Dhaka,Munshiganj,
ওনি কি মুক্তিযোদ্ধা। যখন কেউ না থাকবে তখন অন্য কথা।,Dhaka,Gazipur,
"""তো আরকি, এইবার বীর মুক্তিযোদ্ধা ইশরাকের নতুন দিগন্ত শুরু হবে। মুক্তিযুদ্ধ সম্পর্কে নতুন নতুন ইতিহাস প্রনায়ন করবে। এমনিতেই ইতি…""",Dhaka,Chittagong,Gazipur
অথচ বীর মুক্তিযোদ্ধা ফজলুর রহমান কে দিতে পারতো,Dhaka,,
সে যুদ্ধে গেছিল আমি তার সহযোদ্ধা ছিলাম গুলিতে তার বুকটা ছারখার হয়ে গেছিল এটা নিয়ে বিরোধ করলে রাজুতে ডাক দিব,Dhaka,,
সে তো সে সময় বাচ্চা ছিল। অবশ্যই এখানে বিএনপি'র এডভোকেট ফজলুর রহমানকে আনা উচিত,Dhaka,,
নিশ্চয়ই কেয়ামতের আগে অযোগ্য মানুষ বড় বড় সিংহাসনে বসবে। এতে হতাশ হওয়ার কিছুই নেই ভাই।,Dhaka,,
এরে দেখলে ক্যান জানি চাপড়াইতে মন চায়,Dhaka,,
"""tar mane betay kono kamera na, eda BNP o bujhche!""",Dhaka,,
জার জন্ন যুদ্ধের পরে সে আবার মুক্তিযুদ্ধ বিষয়ক হয় কেমনে,Dhaka,,
ভাই এর নামটা মুক্তিযোদ্ধা লিস্টে দেওয়া যায় না,Dhaka,,
ইয়ে আব কনসি চিরিয়া কা নাম হে বেটা ?,Dhaka,,
আর মানুষ পাইলো না,Dhaka,Kishoreganj,
Oke sweeper banano hok,Dhaka,,
আহ কি খুশিরে,Chittagong,,
@আল্লাহ সর্বশক্তিমান:তান্ত্রিক ওমর ফারুক কবিরাজ যে কোন সমস্যা থাকলে বল তত ইনশাল্লাহ স্বামী স্ত্রী অমিল প্রেম ভালোবাসা ব্যর্…,Dhaka,,
"""ইউজার অথবা মাস্টার একাউন্ট করতে যোগাযোগ করুন। সারা দেশে ৩০% কমিশনে মাস্টার এজেন্ট নিয়োগ, ১ টাকাও ইনবেস্ট করতে হবে না। …""",Dhaka,,
"""ভাগ্যভালো, চুমু শপি হয় নাই। …""",Dhaka,,
"""মেয়র হতে চেয়েছিলো, হয়ে গেলো প্রতিমন্ত্রী …""",Dhaka,Khulna,
I have a plan,Dhaka,,
কবে জানি নামের আগে বীর মুক্তিযোদ্ধা লাগায় দেয়,Narayanganj,,
Follo tu follo bak 100% garente,Dhaka,,
ইসরাক ভাই আমার বয়স ৩০ আমিও মুক্তিযুদ্ধ করছি ভাই আমাকে একটা ভাতা দেওয়ার ব্যবস্থা করিয়েন আমার পোলাপান জেনো কোডা পায়,Dhaka,,
যুদ্ধ নিয়ে সে কি বুঝে? তার কি তখন জন্ম হয়েছিল?!!!!!,Dhaka,,
ভাই ধাক্কা ধাক্কি আবার কবে করবেন?,Dhaka,,
গোয়া মারছে,Dhaka,Narsingdi,
Halr po ala,Chittagong,,
কিছু পর দেখবো ওর নাম মুক্তিযোদ্ধা লিস্টে সবার উপরে,Chittagong,Chandpur,
Klk dekben oni onar bap ma pola meya sob muktijoddha,Dhaka,Tangail,
Khaiya diche re muktijuddhare,বরিশাল,Barishal,Barisal
শেষ ধ্বংস,Dhaka,,
"""হা হা হা,,,,""",Chittagong,,
আলহামদুলিল্লাহ সুন্দরভাবে দেশ পরিচালনা করুন এটাই কাম্য,Dhaka,,
এই ও দেখা লাগলো বাঙালির,Dhaka,,
Nice pic,Dhaka,,
আচ্ছা কোন যুক্তিতে সে এই পদ পাইলো,Dhaka,,
ওরে ল্যাওড়া,Dhaka,,
ইতিহাসের বারোটা বাজিয়ে দিবে,Dhaka,Gazipur,Tangail
প্রতিমন্ত্রী কে প্রতিবন্ধী পরে পেলছি,Chittagong,,
কাম সারছে,Barisal,Bhola,
সবাই হাসে ক্যা,Dhaka,,
"""নিমডা দোজরাজ টেলমি, হারতাবুশ ক্রাকুইকিনইন বুমলাহ মহিনুজ্জুকু লো হাকুয়ে""",Dhaka,Rangpur,Bogura
খোকা পুত্র ইশরাক,Dhaka,Mymensingh,Sherpur
চলিতেসে সার্কাস,Sylhet,Moulvibazar,
প্রতিমন্ত্রী হিসেবে হেতের কাজ টা কি,Dhaka,Khulna,
হোগা মারা সারা,Dhaka,,
অভিনন্দন,Dhaka,Mymensingh,
আল্লাহরে এডা কি হইলো,Comilla,,
"""Bhai vlo korse, oy ar nogor daddyr jonno abedon k9rte parbo na""",Dhaka,Madaripur,
দেশের বারোটা বাজাইবে,Dhaka,,
"""হতে চাইলেন মেয়র, তাকে মন্ত্রী করা হয়েছে, এটা অন্যায়""",দিনাজপুর,,
আস্তাগফিরুল্লাহ!,Dhaka,,
স্বাধীনতার 53 বছর । দেশ প্রেমিক মুক্তিযোদ্ধারা দেশ চালানো দেশের মানুষের উচ্চ ও নিম্ন মান সেবা গুলো …,Narayanganj,,
একটা জিনিস বুজলাম না বিরোধীদলের কোনো এমপিকে মন্ত্রী পদে দেখলাম না,Dhaka,,
মুক্তিযুদ্ধ বিষয়ক মন্ত্রণালয় তো আগেই ছিল। এবার এটা জুলাই বিষয়ক মন্ত্রণালয় না বানায়!,Dhaka,,
আমি মনে হয় ইসরাক কে মুক্তি যুদ্ধ করতে দেখেছি আমার পাশেই ছিল,Dhaka,,
Masahallah,Dhaka,,
উনি তখন জন্মগ্রহণী করে নাই আর তাকে দিয়েছে মুক্তিযুদ্ধ বিষয়ক প্রতিমন্ত্রী । অন্য দপ্তর কি ছিল না?,Dhaka,Tangail,
কামার কে দিলো কুমারের কাজ,Dinajpur,,
কখন যে বলে বসে সেও মুক্তিযুদ্ধে কারন হাসিনা আমলে সম্ভব তাই,Dhaka,,
আমার পেইজটিতে আমন্ত্রণ রইলো,Noakhali,,
"""পজিটিভ রিপ্লাই (কারো খারাপ সময়ে কমেন্ট করার জন্য) খারাপ সময় শেষ হয়, শক্ত মানুষ শেষ হয় না।…""",Dhaka,,
যত দাড়ি টুপি লোক আছে সবাই হবে ৱাজাকাৱ জনাব ইশৱাক যখন মুক্তিযুদ্ধ মন্ত্ৰী,Dhaka,,
সবাই সাপোর্ট করবেন প্লিজ লাইক ফলো দিয়ে পাশে থাকবেন ধন্যবাদ সবাইকে,Dhaka,,
United States of Bagura,Dhaka,,
"""ভীড় ঠেলে যেই যুদ্ধ করে সামনে যায়,, এটা দেখার পরে তারেখ জিয়া মনে হয়, এরে এই পদ দেয়ার সিন্ধান্ত নিয়েছে""",Dhaka,,
ওরে বাটপার,Mymensingh,,
Fozu pagla k asha korchilam,Khulna,Magura,
স্বাধীনতার ৫৪ বছর পরে এই মন্ত্রণালয়ের কাজটা কি,Dhaka,,
কিন্তু ওয় শপথ নিসে জামাতের সাথে। যেই লোক জীবনের এত গুরুত্বপূর্ণ েও লেট করতে পারে সে মন্ত্রণালয়ে কি করবে? …,Dhaka,,
ফজলুর রহমান কি দোষ করলো?,ব্রাহ্মণবাড়িয়া,,
ইশরাক ভাইকে দেওয়া দরকার ছিলো ঘেরাও ও নিজে নিজে শপথ নেওয়া বিষয়ক মন্ত্রী,Dhaka,Madaripur,
কোন বলে বসে। সে নিজেই মুক্তিযোদ্ধা ।,Feni,,
কাম ছাড়ছে,Thakurgaon,,
হেতে মুক্তিযুদ্ধের কমান্ডার ছিলো,Chittagong,Noakhali,
ভাই আমারে সার্টিফিকেট দেওয়া যাবে টাকা দিবো ১০ হাজার।,Dhaka,,
একে তো তালা আর ঘেরাও বিষয়ক মন্ত্রী বানানো উচিত ছিল,Rajshahi,Dinajpur,
এখন বলবে আমি নেই যুদ্ধ ঘোষনা করলাম অন্য কোন দেশ লাগবে না,ঢাকা,Dhaka,Narayanganj
কি যে বিনোদন,নরসিংদী,Dhaka,Jamalpur
Des ta ses,Dhaka,,
মেয়রের আশাও শেষ,Dhaka,,
হাস্যকর,Dhaka,,
তাকে যেনো কোনো মিডিয়ার সামনে না আনা হয় কারণ তার কথা শুনলে আমার হাঁপানি উঠে। …,Dhaka,Kishoreganj,
মুক্তিযুদ্ধের সময়ের ২য় শিশু মুক্তিযোদ্ধা,Jessore,,
মান্নার ডায়লগ খুব মনে পরছে,Dhaka,,
হেঁ*ডা,ঢাকা,Dhaka,Chittagong
ইশরাক হোসেন কে প্রধান মন্ত্রী করার জোর দাবি জানাচ্ছি,Dhaka,Tangail,
যাক মেয়রের তো দামটা পায়নি এবার গোয়া মেরে দিবে নে,নরসিংদী,Dhaka,Narsingdi
sobay hahahaha disse kno?,Khulna,Bagerhat,
আহারে এইভাবেও দেশটাকে ধ্বংস করে দেয়,Dhaka,Madaripur,
"""ইশরাক ছেলেটা ভালো, তাকে আমি নিজে মুক্তিযুদ্ধ করতে দেখেছি""",Dhaka,,
এখন এদেরকে এখন মুখস্থ করা লাগবে কারন ভাইবা বোডে এদের কে নিয়ে প্রশ্ন করা হবে,Dhaka,,
ফজলুল রহমান পারফেক্ট ছিল,Dhaka,Gazipur,
হোগাই মারছে,বরিশাল,Barishal,
Congratulations,Dhaka,Gazipur,
দেয়া ও ভালোবাসা রইল ভাই,Dhaka,Manikganj,
তিনি কি ছিলেন মুক্তিযুদ্ধের সময়?,Dhaka,,
আমার আইডিটা ফলো করে দাও,Dhaka,,
এটা আসলে মানায়নি,Dhaka,,
যাত্রা শুভ হোক।,Dhaka,,
এইটা ফজলুর রহমানরে দেওয়া দরকার ছিল,Dhaka,,
ধন্যবাদ।।,Dhaka,,
হাসবো না কাদবো?? সবাই একটু বলে যান।,Dhaka,,
"""বাহের কোটায় মুক্তি যুদ্ধ মন্ত্রী, মুক্তিযোদ্ধা লিস্টে হেতার নাম জানি চলে আসে না আবার।""",Dhaka,,
উনি মুক্তিযোদ্ধা,Dhaka,,
অভিনন্দন জানাই আপনাকে।,Dhaka,,
আল্লাহই জানেন এখন আবার কোন ইতিহাস পড়তে হয়,Dhaka,,
অভিনন্দন,Dhaka,,
আসলে কি বলবো দুঃখের কথা। যে সমস্ত জায়গা যাদের দরকার সে সমস্ত জায়গায় তাদের দেওয়াদরকার।,Dhaka,,
Adv Fazlur Rahman k kora uchit chilo Muktijoddho bishoyok montri.,Dhaka,,
হা হার সংখ্যা এত বেশি কেন,Khulna,,
প্লিজ কেউ ফলো করে দেও,Dhaka,,
আসসালামুয়ালাইকুম আমার প্রিয় বন্ধুরা সবাই ফলো করে পাশে থাকবেন আমার ছোট পরিবারের,Dhaka,,
