Comment,Sentiment,sentiment_confidence,sentiment_source,needs_review
লিডার চালিয়ে যান পুরো পৃথিবী আপনার বিপক্ষে থাকলেও আমি পৃথিবীর পক্ষেই আছি,Positive,0.3152671812220947,manual,False
ভোট দিবো ধানের শীর্ষে চাঁদা তুলবো মিলেমিশে,Sarcastic_negative,0.4129735639279795,manual,False
"ছেলেটা দারুণ সাহসী। এতো জুতা খাওয়ার পরও নতুন নতুন বানী নিয়ে চলে আসে,, বাহ -- লেগে থাক ভাই..
",Sarcastic_negative,0.3171628964234322,manual,False
জনগণের ইচ্ছে যাকে খুশি তাকে ভোট দিবে দেশ টাকার বাবার না স্বৈরাচারের মতো ব্যবহার করে পরিপাশে আগস্টের মত শেখ হাসিনার মত হবে ইনশাআল্লাহ,Positive,0.5984479894842938,manual,False
এদেশের গর্ব তুমি ভাই আরও এগিয়ে যাও! পাবনার দিকে,Sarcastic_negative,0.5723739336490498,manual,False
সাহসী নেতার সাহসী বাণী!,Positive,0.3260782175285262,manual,False
"""১২ তারিখের পর ওই এলাকার মানুষ ওকে খুঁজবে। আর ও কোথায় থাকবে, তা জানা নেই।",Negative,0.3820380762826344,manual,False
"তারুণ্যের প্রথম ভোটটি হোক অন্যায়, দুর্নীতি, চাদাবাজি, ঋণ খেলাপির বিরুদ্ধে। ন্যায় সততা ও ইনসাফ এর পক্ষে, শিক্ষিত মার্জিত! একজন ভালো ব্যক্তির পক্ষে!",Positive,0.6466374867898778,manual,False
,Neutral,1.0,manual_second_pass,False
নেতা এমনই হওয়া দরকার,Positive,0.4684038585276586,manual,False
বেশি লাফালাফি করলে দাঁড়িয়ে থাকতে পারবে না,Negative,0.5046398893419402,manual,False
চাঁদাবাজ মুক্ত সন্ত্রাস মুক্ত দূর্নীতি মুক্ত দেশ গড়তে দাঁড়িপাল্লায় ভোট দিয়ে জয়যুক্ত করুন ইনসাফের রাষ্ট্র গঠন করুন।,Positive,0.6537141862415697,manual,False
প্রতিহিংসার রাজনীতি না করি কিভাবে দেশে ভালো কিছু করা যায় সেভাবে কাজ করি,Positive,0.621699412555699,manual,False
"নৌকা গেছে যে পথে, ধানের শীষ যাবে সে পথে। নৌকা আর ধানের শীষ লাঙ্গল দেখাও শেষ, দাঁড়িপাল্লা গড়বে এবার সোনার বাংলাদেশ।",Positive,0.6189323426571106,manual,False
সব জায়গায় একই অবস্থা নির্বাচন বন্ধ করে দেওয়া হোক আমি লীগকে ঘুরিয়ে নিয়ে আনুক তারা বিপক্ষে কোন দলকে সাইট দেয় না হুমকি দিয়ে থাকে প্রতিটা ওয়ার্ড পর্দা থেকে একই অবস্থা,Negative,0.4333127554066169,manual,False
"দল থেকে দেরকে আজীবনের জন্য বহিষ্কার করা হোক,, নয়তো বিএনপি-র ইজ্জত মাঠে থেকে যাবে বাসায় নিয়ে ফিরতে পারবে না",Negative,0.5446264875994645,manual,False
ক্ষমতা আসার আগেই এতো কিছু। ক্ষমতা আসার পর কি হবে একমাত্র আল্লাহ জানে,Sarcastic_negative,0.3350643030866991,manual,False
"দেশের জনগণ এখন সচেতন। জোরজবরদস্তির রাজনীতি এখন আর চলবে না মানুষ আদর্শবান নেতা চায়, যার হাতে নিরাপদ দেশ ও জাতি",Positive,0.8111880696720509,manual,False
এই বক্তব্য জামাতের কেউ দিলে রাকিব চাচা দল বল নিয়ে রাস্তায় নাইমে যাতো,Negative,0.3858436877728405,model_autofill,False
বিএনপি আস্তে আস্তে আসল রূপে ফিরে আসতেছে,Negative,0.3922074327935571,model_autofill,False
"একবারে আওমী সন্ত্রাসীদের হুংকার দিয়ে ভোটারদের জিম্মি করতে চাই,এগুলো কে জনগন আর ভয় করে না।",Positive,0.345299850089309,model_autofill,False
নব্য ফ্যাসিজম,Sarcastic_negative,1.0,manual_second_pass,False
ভালবাসা দিয়ে মানুষের মন জয় করতে হয় ভয় দেখিয়ে নয়,Sarcastic_negative,0.4353929089752684,model_autofill,False
ওকে দশটা জুতার বাড়ি দেওয়া হোক,Negative,0.3311016455744056,model_autofill,False
দেন উনাকে ভাইরাল করে চান্দে উঠাইবেন,Sarcastic_negative,0.3627977172094994,model_autofill,False
এই পাগল ছাগলরা দলটাকে শেষ করে দিলো,Negative,0.3777729467200875,model_autofill,False
এই সময় এই ধরনের শব্দ যেই করবে দল থেকে বহিষ্কার করা উচিৎ। আজকাল এই গুলো মানুষ ভয়পায়না।,Negative,0.4890039445265238,model_autofill,False
এজন্যই ত জাতি এঁদের থেকে মুখ ফিরিয়ে নিয়েছে।,Negative,1.0,manual_second_pass,False
দম্ভ ধ্বংস হোক,Negative,1.0,manual_second_pass,False
এরকম কিছু পাগল না থাকলে নির্বাচনীয় মাঠ গরম হয় না।,Sarcastic_negative,0.358722572744955,model_autofill,False
ভোট দিবো কিশে ধানের শীষে,Sarcastic_negative,0.3764218977244323,model_autofill,False
আপনাদের জরিপটা সুন্দর লাগলো এটাই বাস্তব আর অন্যগুলোতে সবাই শক্ত অবস্থায় আছে সেখান থেকে কিছু সিট বিএনপি পাবে মোটামুটি,Negative,0.4313035481407538,model_autofill,False
ইনশাআল্লাহ ধানের শীষ আমি আসা করি বিএনপি ক্ষমায় আসলে বাংলাদেশ নতুন বাংলাদেশ হয়ে উঠবে আবার,Positive,0.3888618732885247,model_autofill,False
যে মন পঞ্চগড় এক আসন বিএনপি ধানের শীষ জিতবে,Negative,0.3710931207585661,model_autofill,False
কুমিল্লা নাঙ্গলকোট আসন বিএনপি বিশাল ভোটে জয় লাভ করবে,Negative,0.4245893477097406,model_autofill,False
পাগলের সুখ নাকি মনে মনে এই পাগলামি নির্বাচনের পরে কোথায় থাকবে আপনার,Sarcastic_negative,0.3974279248765706,model_autofill,False
আমাদের মুন্সিগন্জ জেলার ২ নং আসন লৌহজং ও টংগি বাড়ি এডভোকেট আব্দুল সালাম আজাদ ১০০% নিসচিত ইনশাআল্লাহ,Positive,0.4015293461559579,model_autofill,False
এই খবর দেখে আপনারা বিএনপির ভাইরা আনন্দে গদ গদ ইয়েন না। ফলাফল ঘরে তোলা পর্যন্ত অতন্দ্র প্রহরীর মত ভোট কেন্দ্র পাহারা দিবেন ।সবার বড় দায়িত্ব মহিলাদের ভোট কেন্দ্রে নিয়ে ভোট দেয়ানো ।ভোট দেয়ার পর মহিলাদের সম্মানের সহিত বাড়িতে পৌছে দিতে হবে,Negative,0.3463660435939149,model_autofill,False
আপনার ধারণা অনেকটাই সত্য।,Sarcastic_negative,0.3945308511343631,model_autofill,False
সঠিক মোট ২২০ পাবে,Neutral,1.0,manual_second_pass,False
লক্ষীপুর জেলায় কোন আসন না পেলেও লক্ষীপুর ৪ শতভাগ নিশ্চিত ইনশাআল্লাহ,Negative,0.4124160002511469,model_autofill,False
নোয়াখালী পাঁচ ফখরুল ইসলাম 100%,Sarcastic_negative,0.359081012699225,model_autofill,False
হবিগঞ্জ সদর আছে নাম্বার ওয়ান আলকাত জি কে গোস বিপুল পুরে পাস হইবো বিপুল ভোটে,Neutral,0.3805419618236991,model_autofill,False
কিসের বি এন পি পাবে ৪২০ আসন,Sarcastic_negative,0.3265408016735785,model_autofill,False
তাহলে আর নির্বাচন দরকার কি।,Sarcastic_negative,1.0,manual_second_pass,False
আপনার জরিপ আমার খুব পছন্দ হয়েছে তবে আরও বেশি আসন পাবে বিএনপি,Negative,0.4336161007685713,model_autofill,False
২৮ কুড়িগ্রাম ৪ বিএন পি জয় নিশ্চিত ইনশাআল্লাহ।,Negative,0.4054594136920282,model_autofill,False
চুয়াডাঙ্গা এক আসন জেলা বিএনপি ৭০% ভোটার এগিয়ে আছে চুয়াডাঙ্গা শরিফুজ্জামান শরীফ ভাই এমপি প্রার্থী হবে,Neutral,0.3741960914902328,model_autofill,False
সময় টিভি কে জয় বাংলা করা হবে শনিবার দিন,Neutral,0.5806079873465927,model_autofill,False
এত বড় গুনিনরা যখন গননা করে দিয়েছে তখন আর ভোটের দরকার কি? রাত থেকেই ফ্যামিলি কার্ড দেওয়া শুরু করে দিক।,Positive,0.4668672540024078,model_autofill,False
এমন ততথো উঠে আসে সুধু সময় টিভিতে,Sarcastic_negative,0.3255703497930992,model_autofill,False
,Neutral,1.0,manual_second_pass,False
মিডিয়া তো দেখছি ১দলিয় কাজ করছে,Negative,0.3503198650234009,model_autofill,False
বিএনপির ইশরাকের কর্মীরা রাতে ভোট দিতে গিয়ে জনতার কাছে ধরা। ভোটকেন্দ্র পাহারা দাও ছাত্র-জনতা।,Sarcastic_negative,0.3270333264028073,model_autofill,False
ইনশাআল্লাহ বিজয় আমাদের,Negative,0.4211995810599845,model_autofill,False
"ইনশাআল্লাহ ধানের শীষের বিজয় সুনিশ্চিত

",Positive,0.4343673718104231,model_autofill,False
ইনশাআল্লাহ দাড়ি পাল্লা বিজয় হবে,Positive,0.3565459541633501,model_autofill,False
"সবাই নাহিদ ভাইকেই দেয়া উচিৎ,,, বিএনপি আওয়ামিলীগ অনেকবার পাওয়ারে আসছে, জনগ উপর শুধু জুলুম করছে তারা,,আল্লাহ দেশের মানুষ কে হেফাজত করুক,, জালিমের হাত থেকে,,",Negative,0.3908866295437817,model_autofill,False
নাহিদ ভাই নিশ্চিত ১০০%,Neutral,0.3413520438351543,model_autofill,False
,Neutral,1.0,manual_second_pass,False
"নতুন প্রজন্ম ভোট দিবে নাহিদ শাপলা কলি কে,,,কিন্তু পুরান আমলের মানুস ভোট দিবে ধানের শীষ",Sarcastic_negative,0.3834399217087537,model_autofill,False
কাইয়ুম জিতবে,Sarcastic_negative,0.3782682541297436,model_autofill,False
শাপলা কলি,Sarcastic_negative,0.3285096052915726,model_autofill,False
শাপলাকলি,Neutral,1.0,manual_second_pass,False
এবার প্রথম ভোট ধানের শীষেই দেবো ইনশাআল্লাহ।,Positive,0.5034707459236973,model_autofill,False
মোবাইলে কল দিয়ে ভোট চাচ্ছে এর মানে বুজতে হবে নির্বাচনে অবৈধ ভাবে টাকা করতেছে,Sarcastic_negative,0.4053640906598209,model_autofill,False
ইত্তেফাক গুটিকয়েক জামায়াত নিয়ে ভোটের জরিপ করে জনগণকে বিভ্রান্ত করার চেষ্টা করতেছে...!! আশাকরি আগামী ১২/০২/২০২৬ইং তাদের এই ভাঁওতাবাজির মুখোশ উন্মোচন হবে ইনশাআল্লাহ।,Negative,0.3501396738456788,model_autofill,False
কতো পন্ডিত এখনও বলে নাহিদরে নাকি ঢাকা ১১ র অর্ধেক মানুষও চিনে না,Negative,1.0,manual_second_pass,False
"মানুষকে টাকা দিয়ে যোর যবদস্তি করে কেনা যাইনা,,ব্যাবহার এবং ভালোবাসায় মুগ্ধ হয়ে যাই",Positive,0.4218644770171912,model_autofill,False
আর কিছি লোক ধরে নিয়ে কথা বলেন,Positive,0.5155819057006609,model_autofill,False
ধানের শীষের বিজয় ইনশাআল্লাহ,Positive,0.4413310263214562,model_autofill,False
ময়লা কোথায় ফালাতে হবে সেটাই জানেনা- ভোটের ভালো জায়গা খুঁজে পাবে কি করে!,Neutral,0.4319594666140109,model_autofill,False
নাহিদ ভাইয়ের বিজয় হবেই ইনশাআল্লাহ,Positive,1.0,manual_second_pass,False
আমার হাতপাখার কথা কেউ কয় না কে,Sarcastic_negative,1.0,manual_second_pass,False
শাফলা কলি,Sarcastic_negative,0.3285096052915726,model_autofill,False
বিজয় নিশ্চিত নাহিদ ভাই,Neutral,0.3547583493576833,model_autofill,False
দল নয় এক জন সৎ এবং যোগ্য ব্যাক্তি কে ভোট দিন ইন শাহ আল্লাহ্।,Positive,0.3268721466252472,model_autofill,False
শাপলা কলি নাহিদ কে,Sarcastic_negative,0.3478154076954344,model_autofill,False
সুন্দর প্রতিবেদন প্রকাশ।,Negative,0.3971353194508014,model_autofill,False
ইনকিলাব জিন্দাবাদ,Sarcastic_negative,0.3385000540347216,model_autofill,False
কাকি চাঁদাবাজির কথা বইলা বিএনপির পোন মারি দিছে,Sarcastic_negative,1.0,manual_second_pass,False
সাড়া বাংলাদেশ জাতীয়তাবাদী সন্ত্রাসী সংগঠন মানুকে ভয় দেখিয়ে ভোট সেন্টারে না যাওয়ার জন্য । গেলে হত্যার করা হবে এখনি সময় রুখে দিতে হবে,Neutral,0.3904763627780037,model_autofill,False
ইত্তেফাক জামাতি মাল,Negative,0.4349614797474855,model_autofill,False
কার সাথে কিসের তুলনা।কই কাইউম ভাই আরও কই গোপালভার,Sarcastic_negative,0.3386543744473763,model_autofill,False
বাড্ডা নতুনবাজারসহ সর্বত্র কাইউমের যে চাদার মহরা চলে এর থেকে রক্ষা পেতে শাপলাকলির বিকল্প নাই,Negative,0.3918432038548743,model_autofill,False
এসব লোক ধরে নিয়ে কথা বলতেছে আমরা জানি । বাড্ডাতে বিএনপি বেশী যখন সিটি কর্পোরেশন নির্বাচন হয়েছে তখন ও দেখছি ।,Negative,0.3972484096725463,model_autofill,False
ধানের শীষ,Sarcastic_negative,0.3401039761586544,model_autofill,False
"যত যাই বলো,বিজয় এবার দাঁড়িপাল্লার,",Positive,0.3787476234645962,model_autofill,False
বিএনপির বিকল্প নেই ঠিক বলেছেন।,Negative,0.3517877197709286,model_autofill,False
ধানের শীষ,Sarcastic_negative,0.3401039761586544,model_autofill,False
"এম এ কাইয়ুম ভাই, ধানের শীষ ইনশাআল্লাহ !",Positive,0.4338005263116333,model_autofill,False
দল মত ধর্ম বর্ণ নির্বিশেষে - ভোট দিবো সবাই ধানের শীষে,Positive,1.0,manual_second_pass,False
নাহিদ ইসলাম জিতবে ইনশাআল্লাহ,Negative,0.3820596158099593,model_autofill,False
ভোটের দিনেই বুঝতে পারবে নাহিদ তার জামানত নিয়ে বাসায় যেতে পারবে না,Negative,0.4385186812302257,model_autofill,False
ইনশাআল্লাহ শাপলা কলি,Negative,0.388400425022744,model_autofill,False
ফেসবুকের জড়িপে জিতে গেছে শাপলা কলি,Sarcastic_negative,0.3829005179266579,model_autofill,False
ধানের শীষ,Sarcastic_negative,0.3401039761586544,model_autofill,False
ধানের শীষ,Sarcastic_negative,0.3401039761586544,model_autofill,False
গোপাল ভাড় নাহিদ বিপুল ভোটে পরাজিত হবে,Neutral,0.4839700771553928,model_autofill,False
ধানের শীষ,Sarcastic_negative,0.3401039761586544,model_autofill,False
নাহিদ তো রাজাকার দের দলে যোগ দিছে,Negative,0.3941921945552416,model_autofill,False
ধানের শীষ,Sarcastic_negative,0.3401039761586544,model_autofill,False
ধানের শীষ,Sarcastic_negative,0.3401039761586544,model_autofill,False
নাহিদ তো রাজাকার দের দলে যোগ দিছে,Negative,0.3941921945552416,model_autofill,False
নাহিদ ভাই পাশ করুক এটা মনেপ্রাণে চাই,Positive,1.0,manual_second_pass,False
ঢাকার মানুষের কৃতজ্ঞতা,Positive,1.0,manual_second_pass,False
কায়ুম ভাই বিএনপি,Negative,0.4128223890177988,model_autofill,False
মাশাআল্লাহ জাযাকাল্লাহ খায়ের,Negative,0.3545275051039337,model_autofill,False
ঢাকা নয় হাবিব ভাই,Negative,0.3242515514664212,model_autofill,False
বদ্দা কিন্তু ডাকসুতেও ছাত্রদলকে জিতাইছিলেন,Sarcastic_negative,0.3790936700586521,model_autofill,False
থাকবো সবাই মিলে মিশে ভোট দিবো ধানের শীষে,Sarcastic_negative,0.3974233348289977,model_autofill,False
দুই পক্ষেই দেখি চরম চাপাবাজি চলতেছে। বিএনপি যদিও জিতে ১৬০/১৬৫ এর বেশি পাবেনা। তবে বিএনপি এইবার জিতার সম্ভাবনা কম।,Negative,0.3865411469323845,model_autofill,False
জামাত এগারো দলীয় জোট 150 + পাবে।,Negative,0.3675978556504167,model_autofill,False
কমেন্ট দেখলে বুঝা যায় জামাত কোন লেভেলের বট তৈরি করে রাখছে...!!!,Negative,0.3785277094893735,model_autofill,False
এই তথাকথিত বুদ্ধিজীবিদের অতিরিক্ত আত্নবিশ্বাসই হয়তো বিএনপিকে ডুবাতে যথেষ্ট।,Negative,0.4631853684095318,model_autofill,False
"এইসব পেইড দালালরা ছাড়া কেউই বলছেনা বিএনপি ক্ষমতায় আসবে।যদি নির্বাচন সুষ্ঠ হয় বিএনপি সর্বোচ্চ একশ সিট পাবে,পরে মিলিয়ে নিবেন।",Negative,0.4443303146922283,model_autofill,False
বুদ্ধিজীবি ১২ কোটি ভোটারের মনের খবর জানে,Sarcastic_negative,1.0,manual_second_pass,False
উনি ঢাকায় বসে ডাকসু নির্বাচনে ফতুয়া দিয়েছিল সেদিক থেকে বুঝেছি হেতার মাথায় কিছুই নাই,Negative,0.3388815228018915,model_autofill,False
ইনার মুখে কয়েকদিন আগে শুনলাম বিএনপি ২৫০+ আসন পাবে আজকে শুনি ২০০+,Negative,0.4303449390919848,model_autofill,False
সস্তা বুদ্ধিজীবী!,Sarcastic_negative,1.0,manual_second_pass,False
রুমিন আপার প্রেডিকশনটা যদি একটু করে দিতেন!!,Sarcastic_negative,1.0,manual_second_pass,False
জাহিদ ভাইয়ের মুখ বন্ধ করার জন্যই মানুষ জামাতকে ভোট দেবে,Negative,1.0,manual_second_pass,False
"জামাতের ইশতিহারে ইসলামকে নৈতিকতা, দায়িত্বশীলতা ও মানবকল্যাণের দর্শন হিসেবে তুলে ধরা হয়েছে। শরিয়াহ বলতে শুধু দণ্ডবিধি নয়; বরং ন্যায়বিচার, দুর্নীতিমুক্ত শাসন, মানবিক মর্যাদা, সামাজিক নিরাপত্তা ও জবাবদিহিকে অগ্রাধিকার দেওয়া হয়েছে",Positive,1.0,manual_second_pass,False
"এই যদি বিনপি বুদ্ধিজীবির অবস্থা হয়, এই দল বেশি দুর যাবে না।",Negative,0.4938557890503228,model_autofill,False
ডাকসুর মত হবে ইনশাআল্লাহ।,Positive,0.417953621404542,model_autofill,False
পাগলা পানি খাইছে,Sarcastic_negative,0.3746429690935231,model_autofill,False
"বহু বছর আওয়ামী লীগ সরকার দেখেছি , বহু বছর বিএনপি সরকার দেখেছি , একবার জামাত সরকার দেখতে চাই ।",Negative,0.3845928545577431,model_autofill,False
আগে থেকে রাস্তা তৈরি,Negative,0.3360915195737047,model_autofill,False
"জনগন বিএনপির মিছিল মিটিংয়ে যায়। কিন্তু, ভোট দিবে বলতেছে দাঁড়িপাল্লায়",Negative,0.32621095809741,model_autofill,False
তোর কথা যেন সত্যি হয় যেমন সত্যি হয়েছিল ডাকসু নির্বাচনে,Sarcastic_negative,0.3449617598092597,model_autofill,False
ছাপরি,Negative,0.3333694265496635,model_autofill,False
জেন ঝি ৪ কোটি ভোটার ইনসাফ কে ভোট দিবে।,Positive,0.4497910096592817,model_autofill,False
বস্তাপচা বুদ্ধিজীবী!,Sarcastic_negative,1.0,manual_second_pass,False
কাচা গান্জা খাইছে।,Sarcastic_negative,0.3362865189043371,model_autofill,False
