Comment,Sentiment,sentiment_confidence,sentiment_source,needs_review
কমেন্ট কিছু বট বাহিনীর খানকির পোলার পাকিস্তানের রাজাকার বিচ দেখা যাচ্ছে,Negative,1.0,manual_second_pass,False
চাঁদাবাজ তারেক রহমান,Negative,0.3286952839377471,model_autofill,False
বিএনপি চাঁদাবাজ,Negative,0.4508857611286512,model_autofill,False
খাম্বা ছিল কারেন্ট ছিল না এখন কাট থাকবে টাকা থাকবে না,Sarcastic_negative,0.3583657245114332,model_autofill,False
কমেন্টে কিছু জারক আছে এই পাকিস্তানি ব্রিজ দেরকে একটু জবাব দেন সবাই,Negative,0.5301226375774812,model_autofill,False
শালা বট বাহিনীর খানকির পোলার,Negative,0.3598402746431694,model_autofill,False
চাঁদাবাজ বয়ক,Negative,0.3853934631793951,model_autofill,False
প্রত্যেকটা পরিবারের গুদমারানি দিব আমরা,Negative,0.4940763002830387,model_autofill,False
পাচদা বাঁশ দিয়ে দিব,Sarcastic_negative,0.3519188659463791,model_autofill,False
নারীদের তো এখনই মাইর শুরু করে দিছো মি.খাম্বা,Positive,1.0,manual_second_pass,False
খাম্বা চুর,Sarcastic_negative,0.3349606612329666,model_autofill,False
হা ভুয়া খাম্বা,Negative,0.3372763691177858,model_autofill,False
ভুয়া ভুয়া,Negative,1.0,manual_second_pass,False
আগে নিজের দলের ইনকিলাপি আছে তাদের ঋণ পরিশোধ কর,Negative,0.4328399025999868,model_autofill,False
দাঁড়িপাল্লা দাড়িপাল্লা দাড়িপাল্লা দাড়িপাল্লা,Positive,1.0,manual_second_pass,False
দাঁড়িপাল্লা দাড়িপাল্লা,Positive,1.0,manual_second_pass,False
,Neutral,1.0,manual_second_pass,False
চান্দাব্বাস হাদী হত্যা ভূমিকায় অপরিসীম।,Sarcastic_negative,0.4229368446331889,model_autofill,False
কথাটা তো মনের নাম মুখের কথা,Positive,0.3572038100053348,model_autofill,False
আপনাদের রাজনীতি যদি সঠিক পথে থাকে তাহলে আপনাদের এত কথা বলার দরকার নেই জনগণ তাদের রায় দিয়ে দিবে,Positive,0.4373491002487366,model_autofill,False
তাহলে তো দেখি ফেসবুকে দলে দলে মানুষ আওয়ামী লীগ থেকে বিএনপিতে যোগ দিচ্ছে আপনি তখন চোখে দেখেন না আসলে সবাই মিথ্যুক,Negative,0.4722754221022799,model_autofill,False
"বিচারের দাবি নাই, তাই আপাকে দেশে না এনে দাদাদের কাছেই রাখতে চায়!! নতুন বন্দোবস্ত",Sarcastic_negative,0.4659381264765166,model_autofill,False
"আপনারাই তো হাসিনার পক্ষে কথা বলেন,,এখন সুর বদল হইছে",Positive,0.4536061613239686,model_autofill,False
চান্দা জনগণ তোমারে ভোটে শিক্ষা,Sarcastic_negative,0.4890294166027266,model_autofill,False
এগুলো এখন মানুষ বুঝে,Positive,0.351821212303074,model_autofill,False
কি কয় এই পাগলায়,Negative,0.4843795649466257,model_autofill,False
কিরে এত সহজে বাইরে গেল ভাষণ,Sarcastic_negative,1.0,manual_second_pass,False
এ দেশে আসামি নিরাপদ,Sarcastic_negative,0.3626019229676679,model_autofill,False
অনেক সুন্দর কথা,Positive,0.3437957731455273,model_autofill,False
বিনপি তো আওমীলিগ সাথে নিতে ছে,Sarcastic_negative,0.338047446092249,model_autofill,False
এটা বুঝতে অনেক দেরি হয়ে গেছে....,Sarcastic_negative,1.0,manual_second_pass,False
চাঁন্দা আব্বাস,Negative,0.4030661125877161,model_autofill,False
Toi khoni,Sarcastic_negative,1.0,manual_second_pass,False
হাদি ভাইয়ের বিচার চাই ।,Negative,0.3733508420537233,model_autofill,False
"মুরুব্বী মুরুব্বী,, সৃষ্টির ষষ্ঠা একজনই",Neutral,1.0,manual_second_pass,False
রং লেগেছে,Sarcastic_negative,0.3252338333657554,model_autofill,False
ভালোয় লাগছে,Positive,1.0,manual_second_pass,False
Batpar,Negative,1.0,manual_second_pass,False
কাকু সময় বদলাইছে ওহন পাব্লিক আগের পুরানা নষ্ট খাবার খায় না,Sarcastic_negative,0.3442587407911566,model_autofill,False
বাটপার,Negative,0.4809830535735718,model_autofill,False
মির্জা আব্বাস হল,Negative,0.4218325107560862,model_autofill,False
বিএনপি'র মীরজাফর।,Negative,0.4493180623483842,model_autofill,False
আপনার চেহারা ছবি তো তার প্রমান জনাব।,Sarcastic_negative,0.3494135593166584,model_autofill,False
দাদু গিরগিটির মতো রং চেঞ্জ করো না তোমাদের মুখে একটা অন্তরে আরেকটা,Negative,0.4384441720759847,model_autofill,False
তুমি এত ভালো মানুষ এত ভয় পাও কেন ভালো মানুষের তো ভোট আছি তাই এত ভয় পাও কেন,Sarcastic_negative,1.0,manual_second_pass,False
যদি সঠিক নির্বাচন হয় ৷ এমন মারা দিবো জনগনে মরার পরেও ভূলতে পারবে না ৷,Negative,0.3900666057151105,model_autofill,False
"ভারতীয় রং আপনাদেরকে কেউ লাগাতে পারবেনা কারন ভারতীয় রং ইতিমধ্যে আপনারা গায়ে মেখে এসেছেন, ষার।",Negative,0.4657583680405288,model_autofill,False
ID Dallas,Sarcastic_negative,1.0,manual_second_pass,False
আওয়ামিলীগকে আপনারা আস্রয় দিতেছেন।,Sarcastic_negative,0.4949765501228516,model_autofill,False
তোরে কে ভোট দিবো,Sarcastic_negative,0.3624338915967034,model_autofill,False
আপনার দুই পা কবরে কি আর বলবেন মুরবি,Sarcastic_negative,0.3845575467633046,model_autofill,False
বিশ্বাসের মা মারা গেছে।,Sarcastic_negative,0.3523220443250435,model_autofill,False
কথা বলতে পারেনা,Negative,1.0,manual_second_pass,False
"বন্দু,তুমি,,যাই,,বলো,,,লিগের,,দুসর",Sarcastic_negative,0.5175923869993972,model_autofill,False
গডফাদার,Negative,1.0,manual_second_pass,False
বিএনপির মির্জা আব্বাস ভাই খুবি অসন্তুষ্ট ঢাকার আসনে অন্য জেলার মানুষ কেন নির্বাচন করতে আসছে।,Negative,0.3918076699180269,model_autofill,False
এ্যালার্ট,Negative,1.0,manual_second_pass,False
"Insaf , Zindabad .",Sarcastic_negative,0.3574898602354987,model_autofill,False
এ-র জন্যই হাদিকে সরিয়ে দিয়েছিস,Negative,1.0,manual_second_pass,False
ঢাকা -৮ এ চান্দাবাজ এর স্থান আর হবে না ইনশাআল্লাহ,Positive,0.4788524419427258,model_autofill,False
চান্দাব্বাছ,Sarcastic_negative,0.5346280650110575,model_autofill,False
Ata aponar kota awomilige vokto 6 kote votarar kota na.awomiliger shomay moto asbei karor bapero khomota ni feranor.,Sarcastic_negative,0.3692546745410921,model_autofill,False
চান্দাব্বাস,Sarcastic_negative,0.4996815341891294,model_autofill,False
"আপনার দলই তো, আওয়ামী লীগ কে দলে এডপ্ট করতেছে।",Sarcastic_negative,0.4684755174178958,model_autofill,False
হ্লা ফ্লাউল,Sarcastic_negative,1.0,manual_second_pass,False
হাসিনাকে তোমরা নিয়ে আসবা,Negative,0.3714145233580507,model_autofill,False
চান্দাভাই ডরাইছে।,Sarcastic_negative,0.5176956460662782,model_autofill,False
মনা তুমি 3rd হবা,Neutral,0.4532410727177858,model_autofill,False
সুর পাল্টায় কেন,Sarcastic_negative,0.4244383941411169,model_autofill,False
"এই কথা আওয়ামী থাকলে আপনাদের ব্যাপারে ও প্রচুর বলেছে রাতদিন বলেছে, এখন কোন দেশের জনগন পারলো? আওয়ামীর পরে আপনাদের পালা এখন!",Positive,0.3363185604133231,model_autofill,False
হু হু হা হা,Negative,0.3669677187750402,model_autofill,False
ভারতীয় রং আপনারা নিজেরাই গায়ে লাগিয়ে গুরতেছেন,Sarcastic_negative,0.4118650940677677,model_autofill,False
এখন নতুনদের রাজনীতিতে আসা উচিৎ পুরানদের খানা নেই,Positive,0.4336853788070562,model_autofill,False
"জনগণ কে সিদ্ধান্ত নিতে দিন , আপনারা বাধা দিচ্ছেন কেন ?",Sarcastic_negative,0.5113587002595313,model_autofill,False
"কালার না সত্যি, নিজের বংশের কিছু লোক কে এমন দেখলাম। আর কারে কি বলবো।",Negative,0.3515589273748442,model_autofill,False
৮ এর জনগন বুঝে শুনে ভোট দিবে,Sarcastic_negative,0.4930055573514257,model_autofill,False
বাংলা সিনেমা পাবলিক দেখে না সিনেমা র হল গুলো বন্ধ হইয়া গেছে,Sarcastic_negative,0.457952990001156,model_autofill,False
আপনি তো হাদিকে মারচেন আল্লাহ বিচার করবেন ইংশাললাহ অপেক্ষায় থাকেন,Negative,0.3890863771535598,model_autofill,False
মীরজা ওবায়দুল কাদের,Sarcastic_negative,1.0,manual_second_pass,False
আরে আসতে কতক্ষণ?,Positive,0.3538255070885913,model_autofill,False
হাদি ভাই থাকলে.... দেখা যাইত...,Negative,0.550210266353944,model_autofill,False
ভারতীয় রং কন রং কে বলা হয় যদি একটু বলেন তাহলে বুঝতে পারতাম।,Negative,0.3617402378392831,model_autofill,False
চান্দা আব্বাস।‌।,Sarcastic_negative,0.3909075419881699,model_autofill,False
এএএএএ চোষড়,Sarcastic_negative,1.0,manual_second_pass,False
রঙ লাগিয়ে কেউ দেয় নি দাদু,Sarcastic_negative,1.0,manual_second_pass,False
তোমাদের কৃতকর্মের কারনেই তোমাদের গায়ে রঙ লাগছে।,Negative,0.3736725532367596,model_autofill,False
"তুমি হলে,,,",Sarcastic_negative,0.4782275667780134,model_autofill,False
লা ই ন দেহি সোজা হইতাছে,Sarcastic_negative,1.0,manual_second_pass,False
"ঢাকা ৮ এর জনগণ, অবশ্যই হাদী ভাই এর হত্যার বিচার করবে, চান্দাব্বাসকে হারিয়ে",Sarcastic_negative,0.3736183385509368,model_autofill,False
সব আওয়ামী লীগ তো বিএনপিতে যোগ দিতাছে।,Negative,0.432515487317411,model_autofill,False
বুঝলাম না এতগুলা কমেন্টসের ভিড়ে আমি একটু পজিটিভ কমেন্টস খুজতেছিলাম,Negative,0.4154919171569556,model_autofill,False
আব্বাস ভাই জিন্দাবাদ,Positive,0.35163345618444,model_autofill,False
ভূয়া,Negative,1.0,manual_second_pass,False
Ora Batper,Sarcastic_negative,1.0,manual_second_pass,False
চাঁন্দা ভাইকে বর্জন করুন,Negative,1.0,manual_second_pass,False
যেখানে স্পষ্ট র*ক্ত দেখা যাচ্ছে,Negative,1.0,manual_second_pass,False
সেখানে রং লাগানোর কী প্রয়োজন,Sarcastic_negative,1.0,manual_second_pass,False
মির্জা আব্বাস সাহেব আপনি।,Negative,0.3983250919553515,model_autofill,False
হাদীকে আপনি থ্রেড দিয়েছিলেন কেন তাকে কেন বলেছিলেন যে তুমি কখনো ওয়ার্ড কাউন্সিলার হয়েছিলে,Sarcastic_negative,0.4141545829265067,model_autofill,False
চান্দাববাছ,Sarcastic_negative,0.5777799575152235,model_autofill,False
keno? protidondi nai? Patoary?,Neutral,0.4398226897361554,model_autofill,False
হাদির খু/নের পিছনে কে থাকতে পারে ?,Negative,0.5256807961408589,model_autofill,False
ব্যাংকের মালিক হইলা কেমনে।,Sarcastic_negative,1.0,manual_second_pass,False
চান্দা আব্বাস,Sarcastic_negative,0.3909075419881699,model_autofill,False
চান্দাবাজদের বয়কট করেছে বাংলাদেশের ছাত্র সমাজ। তার প্রমাণ ছয়টা বিশ্ববিদ্যালয়ের ছাত্র সংসদ ভোটের রেজাল্ট।,Positive,0.3903572079791129,model_autofill,False
১৭ বছর কয় ছিলেন,Sarcastic_negative,0.4372987034316262,model_autofill,False
"নতুন আরেকটি রঙ আবিস্কার বলো, ভারতীয় রঙ",Positive,0.3574453531094513,model_autofill,False
ইনসা আল্লাহ আপনার বিচার খুব শিগগিরই হবে রেডি গয়ে থাকেন,Neutral,1.0,manual_second_pass,False
কে আপনাদের গাঁয়ে ভারতের রঙ লাগিয়ে দিচ্ছে? আপনারা নিজেরাই তো ভারতের রং গাঁয় মেখে বসে আছে!!,Sarcastic_negative,0.4007192160444054,model_autofill,False
কথা শুনে ভালো লাগছে।যার কোন বাস্তবতা রাজপথে নাই।সবই উল্টো,Positive,0.4313305750907528,model_autofill,False
দুর হালা খবিস,Negative,0.3442089633651597,model_autofill,False
র এর এজেন্ট Ab bus,Sarcastic_negative,0.3903365186563042,model_autofill,False
সত্যি তো,Neutral,1.0,manual_second_pass,False
Dhaka 8 mane tumi chanda abbas joy bangla,Sarcastic_negative,0.514112970941489,model_autofill,False
দূর্নিতির বর পুত্র,Sarcastic_negative,1.0,manual_second_pass,False
জুলাই যোদ্ধাদের কারণে আজকে তোমাদের মুখের সেদা দিয়ে কথা আসতাছে,Negative,1.0,manual_second_pass,False
আওয়ামী লীগ পুনর্বাসনের কাজ চলছে,Negative,1.0,manual_second_pass,False
কাকু এতদিন কি করছেন,Sarcastic_negative,0.3480394631452549,model_autofill,False
আরে বাটপার এসব বক্তব্য এতদিন কই ছিল,Negative,0.3793054778740354,model_autofill,False
সে একটা ছেলে নয়! নাসির উদ্দিন পাটোয়ারী নির্বাচিত হয়ে স্বরাষ্ট্রমন্ত্রী ইনশাল্লাহ!,Positive,1.0,manual_second_pass,False
হাদীর বিচার চাইলে চান্দাব্বাসদের হটাতে হবে৷,Sarcastic_negative,0.3398343427731056,model_autofill,False
#JusticeForHadi,Neutral,0.7356243479452386,model_autofill,False
17 bosor val falaise,Sarcastic_negative,0.3692546745410921,model_autofill,False
চাঁদাবাজ ও সন্ত্রাস ভূমিধস দুর্নীতি ৫চ্যামফিয়ান দলকে না বলুন,Positive,0.3592948341426338,model_autofill,False
পাটোয়ারী,Sarcastic_negative,0.3430754997637276,model_autofill,False
Kako ফেল,Sarcastic_negative,0.3240685630828183,model_autofill,False
"টালমাটাল অবস্থায়, হারুন সাহেব বলেছেন এক কথা, ফখরুল এক কথা, মিজ্জা আব্বাস অন্য কথা!",Positive,0.4199380456131829,model_autofill,False
Apnar party lokerai Hasina k anar jonno campain kortece,Sarcastic_negative,0.3692546745410921,model_autofill,False
Hadir khuni...,Neutral,0.5605687428940489,model_autofill,False
শাপলা কলি নাছির উদ্দীন পাটোয়ারী,Sarcastic_negative,0.3582908294700404,model_autofill,False
মির্জা আব্বাস থেকে তো আপনার নাম চান্দা আব্বাস এমনি এমনি হয়নি,Negative,0.4072541460886074,model_autofill,False
আপনার দলের একজন গুরুত্বপূর্ণ ব্যক্তিগত হারুন এই গতকালই বলেছে সে আওয়ামী লীগকে রক্ষা করবে।,Negative,0.4201775392966204,model_autofill,False
Tore o icche kore latthi maira india pathate,Sarcastic_negative,1.0,manual_second_pass,False
That is real truth,Positive,1.0,manual_second_pass,False
পাটোয়ারী,Sarcastic_negative,0.3807492928188926,model_autofill,False
বুঝতে পারছে কিভাবে কথা বললে মানুষ খাবে।,Positive,0.4325192123939581,model_autofill,False
Thank apnake,Sarcastic_negative,0.3679233661218622,model_autofill,False
আপনারা নিজেরাই তো বলতেছেন আওয়ামী লীগের সব মামলা উঠায় নিবেন,Sarcastic_negative,0.4957634404387289,model_autofill,False
জামানত বাজেয়াপ্ত করতে হবে ডার্বি নাসিরের,Neutral,0.5501595844800887,model_autofill,False
এই দেশে এখন আর লোভ বা ভয়-ভীতি দেখিয়ে আর রাজনীতি করা যাবে না দিনে দিনে সবকিছু পরিবর্তন হতে যাচ্ছে।,Positive,0.5762308945258159,model_autofill,False
চান্দা বাবার মুখে ধর্মের বুলি,Sarcastic_negative,0.4912871887063356,model_autofill,False
চান্দা ভাই,Sarcastic_negative,0.4977235357753164,model_autofill,False
হাদি হত্যার সাথে চান্দা আব্বাসকে সন্দেহের বাহিরে রাখা যায় না,Negative,0.3788642283423438,model_autofill,False
তোমাদেরকেও বাংলাদেশ গ্রহন করবে না এর কেউ বাংলাদেশ গ্রহন করবে না,Negative,0.4175527725572185,model_autofill,False
"আগের দিন ভুলে যান, এখন জাতি আর বুড়া দিয়া দেশ চালানো পছন্দ করে না। Generation change হয়েছে।",Positive,0.4970990176672101,model_autofill,False
"গ্রামের মহিলারা এখন অনেক সচেতন, বিএনপি ভুয়া ফ্যামিলি কার্ডের লোভ দেখিয়ে তাদেরকে কিনতে পারবেনা ইনশাআল্লাহ। তারাও ইতিহাস জানে। শেষ পর্যন্ত দেখুন।",Negative,0.4257804643398931,model_autofill,False
Osobbo akta manus mirza abbas,Sarcastic_negative,0.4563302615211024,model_autofill,False
Shala chadabaz shontrashi.agent of raw.,Negative,0.3879854987406019,model_autofill,False
ইনকিলাব মঞ্চের উচিত ছিলো ঢাকা ৮ আসনে প্রার্থী দেওয়া,Neutral,1.0,manual_second_pass,False
গত ১৭ বছর কি করছেন আপনারা,Sarcastic_negative,0.4667409345713501,model_autofill,False
দাদু কদু খাও,Sarcastic_negative,0.337911292401637,model_autofill,False
বি এন পি মুখে মুখে ভালোবাসা দেখায়,Sarcastic_negative,1.0,manual_second_pass,False
"Buira chut,,,,,,,,,, hadire maira akhon 8 asot Tor na,",Neutral,0.4664678623384016,model_autofill,False
ভারতের কাছাকাছি না গেলে কি রঙ লাগতো..?,Negative,0.4139080535262705,model_autofill,False
রাজনিতি,Neutral,1.0,manual_second_pass,False
"চান্দা আব্বাস, হাদি হত্যার সাথে জড়িত তবে সেটা প্রকাশ হতে অনেক সময় লাগবে। আপনারা আওয়ামী লীগের পূর্নবাসন করছেন সেটা জনগণ বলছে।",Negative,0.3730379907745613,model_autofill,False
কেও ওরে একটা ব্রাশ আর একটু হার্পিক কিনে দে মুখ দিয়ে গন্ধ বের হচ্ছে।,Positive,0.392190773025194,model_autofill,False
"আসায় থাকো কাউয়া পাকলে খাইয়ো ডেউয়া, আপনার বয়স হয়েছে তাই আবোল তাবোল বলার চেয়ে কথা কম বলাই ভালো।",Positive,0.3838770497268609,model_autofill,False
একটা রাজনৈতিক দল ফ্যামিলি কার্ডের লোভ দেখিয়ে সরকারে আসতে চাইলে সেটা হবে দুঃখজনক,Negative,1.0,manual_second_pass,False
চান্দা আব্বাস এবার জামানত হারাবি রে,Sarcastic_negative,0.3587241998996938,model_autofill,False
আগেই রেন্ডিয়ার ভিষা রেডি রাখ,Sarcastic_negative,1.0,manual_second_pass,False
র এর এজেন্ট এটা ১০০% সত্যি।,Negative,0.3307982039332593,model_autofill,False
17 বছর ভণ্ডামি করছো।।।,Sarcastic_negative,0.3544771448852622,model_autofill,False
ঢাকাতে সবাই শিক্ষিত যদিও মূর্খ থাকে শিক্ষিতদের সাথে থেকে অনেক জ্ঞানী হয়ে যায়,Negative,0.3415641806171599,model_autofill,False
জ্ঞানীরা সঠিক সিদ্ধান্তই নেবে,Positive,1.0,manual_second_pass,False
নাটক কম করো প্রিয়,Sarcastic_negative,1.0,manual_second_pass,False
চাঁদার জন্য পাথর দিয়ে মানুষ হত্যা কারি দল কে বয়কট করা উচিত।,Negative,0.4147865280338186,model_autofill,False
নিজের আসনের প্রতি কোন আত্মবিশ্বাস নাই নেতার,Negative,0.3718044759187038,model_autofill,False
সারা বাংলাদেশে বিএনপি জিতবে বলতেছে।,Negative,0.3949326218217537,model_autofill,False
এক নামবার চান্দাবাস,Sarcastic_negative,0.49149104181059,model_autofill,False
মির্জা আব্বাস হাদী হত্যাই জড়িত,Negative,0.5048766690653305,model_autofill,False
তার কথার বুঝা যায়,Positive,0.3281479224665881,model_autofill,False
ভারতীয় রং নয় আপনারা ভারতের রঙের মাঝখানে ডুবদিয়া আছেন,Negative,0.4102717145794577,model_autofill,False
হাসি লাগে,Sarcastic_negative,1.0,manual_second_pass,False
