Comment,Sentiment,sentiment_confidence,sentiment_source,needs_review
কারন তর মতো বাটপাড় কেউই নির্বাচনে দাড়ায় নাই...,Negative,0.3990297805760446,model_autofill,False
স্বৈরাচার মুক্ত দেশ গড়তে গণভোটে হ্যা দিন।,Positive,1.0,manual_second_pass,False
ভারতীয় আগ্রাসন রুখতে গণভোটে হ্যা দিন।,Positive,1.0,manual_second_pass,False
মির্জা গাবগাছ,Negative,1.0,manual_second_pass,False
https://www.facebook.com/share/v/1D33nofQRw/,Neutral,1.0,manual_second_pass,False
দাদু কেমন আছেন আপনি পকেটে চাদার টাকা ডুকতে দেরি হচ্ছে,Sarcastic_negative,0.332792091653836,model_autofill,False
ভোটকেন্দ্র আপনার স্ত্রীকে ঢুকিয়ে বুট ধান্দাবাজি করছেন।,Sarcastic_negative,0.5159077748791877,model_autofill,False
https://www.facebook.com/share/v/1K8ysgUnmt/,Neutral,1.0,manual_second_pass,False
#JusticeForHadi #WeAreOsmanHadi,Neutral,0.7356243479452386,model_autofill,False
মোদীর বাচ্চা,Negative,0.3322023513818723,model_autofill,False
https://www.facebook.com/share/1FU68427h1/,Neutral,1.0,manual_second_pass,False
#killarmirza,Negative,1.0,manual_second_pass,False
আইডিতে গিয়ে একটা ফলে দিলে ভরপুর ভালেবাসা পাইবেন এবং ফলে বেগ পাইবেন,Sarcastic_negative,0.3844931509932229,model_autofill,False
আওয়ামী লীগ এর প্রশ্রয় দেওয়ার প্রমাণ তো পথে ঘাটেই দেখা যাচ্ছে,Sarcastic_negative,0.3627704605518277,model_autofill,False
এবার চাঁদাবাজ রে কোন লোক ভোট দেবে না,Negative,1.0,manual_second_pass,False
স্বৈরাচার ফ্যাসিজমের বিরুদ্ধে দাড়ান।,Neutral,0.3383843583834811,model_autofill,False
খান্কিরছেলে কয় কি রে,Sarcastic_negative,0.3521300433573054,model_autofill,False
শহীদ শরীফ ওসমান হাদীর হত্যার পিছনে আপনার হাত আছে এটা বাংলাদেশের জনগণ জানে,Negative,0.3966515303490702,model_autofill,False
পূর্বের ১৭ বছর আপনারা বাল ফালাইছেন না এখন বড় বড় লেকচার ছাড়,Sarcastic_negative,0.3767497011755405,model_autofill,False
"এই দেশের মানুষ, আওয়ামীলীগ ও হাসিনাকে গ্রহণ করবে না কিন্তু আওয়ামীলীগের পদস্থবিদের বিএনপিতে যোগ দিবে ? বাটপার",Negative,0.5212028441587271,model_autofill,False
"#JusticeForHadi আমার ভাইয়ের রক্ত খেয়ে কাউকে হজম করতে দেবো না হাদী ভাই আমাদের এমপি, আমাদের সরকার",Negative,0.3908667570621799,model_autofill,False
কেননা সব সাইটে বাংলাদেশের স্বৈরাচার হাসিনাকে সরাল এত ছাত্র জনতা মির্জা আব্বাস কোন বিষয় না এটা,Negative,0.36172382432353,model_autofill,False
"আমার তো মনে হয় আপনি হয় স্টক করতেন,,নয়তো সুইসাইড করতেন",Sarcastic_negative,0.5276261171074815,model_autofill,False
Kako fail,Sarcastic_negative,1.0,manual_second_pass,False
আব্বাস হাদী হত্যাকারীর পরিকল্পনাকারী,Negative,0.543114976568567,model_autofill,False
https://www.facebook.com/devid.john.774194,Neutral,1.0,manual_second_pass,False
Hadir khuni abbas,Neutral,0.3756556998670133,model_autofill,False
Nasir by,Neutral,1.0,manual_second_pass,False
বিএনপি একমাত্র রাজনৈতিক দল যারা ক্ষমতায় যাওয়ার আগেই বাংলাদেশের সর্বস্তরের জনগণ তাদের পতন চায়,Negative,0.4213829873232617,model_autofill,False
ঢাকা ৮ আপনি পাবেন না মশাই।,Sarcastic_negative,0.4083118558571832,model_autofill,False
ভারতের রং লাগানো আছে বর্তমানে বিএনপিদের গায়ে।,Negative,0.5415545588946284,model_autofill,False
দুধে ধোয়া তুলসী পাতা,Sarcastic_negative,0.3382524682917892,model_autofill,False
ইনশাআল্লাহ,Positive,0.3860122329985906,model_autofill,False
আপনার দলের লোকরাই তো আস্রয় দিচ্ছে এক অংগে কতো পদের রুপ,Negative,0.3576666085088125,model_autofill,False
চান্দা আব্বাসউদ্দীন,Sarcastic_negative,0.4099244185337425,model_autofill,False
সম্পর্ক বদলে গেলো একটি পলকে ভোট চুরের কারণে মির্জা আব্বাস আসলো সংসদে,Negative,0.4053929606119488,model_autofill,False
আপনার বউ হয়েনাকি আসবে হাসিনা কি ?,Sarcastic_negative,0.345756654850713,model_autofill,False
"এটা আবার কেমন রং, এবারের ঈদে আমিও ইউনিক ভারতীয় রঙের জুতো পড়তে চাই",Negative,0.4699221849141141,model_autofill,False
"ভারতের ডান হাত ছিল আওয়ামীলীগ,,, এবং বাম হাত b*p,,,কথা টা মিলিয়ে দেইখেই",Negative,0.3653553739205841,model_autofill,False
কথা যেনো ঠিক থাকে,Positive,0.4114496666214651,model_autofill,False
চোরের মায়ের লম্বা গলা কথাটা আজ বাস্তবে পরিণত হলো,Negative,1.0,manual_second_pass,False
শালা চান্দা আব্বাস,Sarcastic_negative,0.3807893828236528,model_autofill,False
বুইড়া চুন্নি আব্বাসনি কই,Negative,0.4216484579449391,model_autofill,False
remember,Neutral,1.0,manual_second_pass,False
Keno bharat pochhondo koren e toh,Sarcastic_negative,1.0,manual_second_pass,False
Candabaz,Sarcastic_negative,0.402815425699271,model_autofill,False
"দুর্নীতিবাজ,",Negative,1.0,manual_second_pass,False
"আকাম করছো তাহলে কেমনে মেনে নেয় মানুষ,",Negative,0.3410926521933375,model_autofill,False
ভূতের মুখে রাম রাম,Sarcastic_negative,1.0,manual_second_pass,False
আমরা আশাবাদী জনগণ ভোটের মাঠে প্রমান করবে।,Negative,0.3483071392114986,model_autofill,False
নানা আপনি অবসরে চলে যান।,Sarcastic_negative,0.4186241587434516,model_autofill,False
নোয়াখালী এখন কুমিল্লার যারা ঢাকা ৮ আসনের ভোটার আছেন দয়া করে আপনারা সবাই নাসির উদ্দিন পাটোয়ারী কে ভোট দিবেন,Neutral,1.0,manual_second_pass,False
যারা আওয়ামীলীগ করতেন তারা কি এরে ভোট দিবেন,Sarcastic_negative,0.5737356045587703,model_autofill,False
ইনশাআল্লাহ আমরা হ্যাঁ ভোটের মাধ্যমে দেশের সর্বস্তরের জনগণ মিলে সন্ত্রাস চান্দাবাজ টেন্ডারবাজ মুক্ত একটি নতুন বাংলাদেশ গড়তে চাই,Positive,0.3867612914412311,model_autofill,False
,Neutral,1.0,manual_second_pass,False
#Saluting_Our_Cultural_Hero,Positive,1.0,manual_second_pass,False
শাপলা কলি জিন্দাবাদ,Sarcastic_negative,0.35595449187295,model_autofill,False
"মানুষকে ভোটকেন্দ্রে যেতে দিয়েন, যার ভোট তাকে দেয়ার সুযোগ দিয়েন। তাহলেই বুঝবেন আসল খেলা কি।",Sarcastic_negative,0.4523343632550298,model_autofill,False
Mirza abbas BNP inshallah,Sarcastic_negative,0.4563302615211024,model_autofill,False
চাদা আব্বাস হারবে সে খুনি,Negative,0.5983083238789807,model_autofill,False
Public hase,Sarcastic_negative,0.3692546745410921,model_autofill,False
হাদিকে সরিয়ে দেওয়ার পিছনে জামাত কাজ করেছে। হাদি একমাত্র আওয়ামী লীগ ও জঙ্গি জামাতের অন্তরায় ছিলো।,Negative,0.4453179829034199,model_autofill,False
"☞আপনারা আ'লীগের সব মামলা তুলে নিবেন, এটাতো আপনাদের মহাসচিব ঘোষণা দিয়েই দিছে।",Sarcastic_negative,0.4073329220763482,model_autofill,False
#KillerMirzaAbbas,Sarcastic_negative,0.4563302615211024,model_autofill,False
অথচ নিজেদের দলেই আম্লীগের নেতাদের মনোনয়ন দিয়ে রাখসে বাটপার,Negative,0.4678191488627242,model_autofill,False
কবিতা বুঝানোর দিন শেষ,Sarcastic_negative,0.3810049000482717,model_autofill,False
চান্দা আব্বাস এতো লাফায়েন না ঢাকা -৮ পাবেন না,Sarcastic_negative,0.3733327542383209,model_autofill,False
বিএনপিকে ভোট দেওয়া মানে নিজের পায়ে নিজে কুড়াল দেওয়া,Negative,0.3772763190830356,model_autofill,False
আপনি নিজেই তো প্রতি সপ্তাহে সদলবলে গণভবনে যেয়ে হাসিনার সাথে চা খেয়ে আড্ডা মেরে টাকা নিয়ে আসতেন!,Negative,0.3605540229198758,model_autofill,False
সেজন্য আওয়ামীলীগ কে দলে নিচ্ছেন দল ভারি করতে।মনে রাইখেন পাপ বাপকেও ছাড়েনা।,Sarcastic_negative,0.3654614481092081,model_autofill,False
মীর্জা আব্বাস না মীর্জাফর,Positive,0.3534642391206442,model_autofill,False
সুষ্ঠ নির্বাচন হলে মির্জা আব্বাস ফেল,Negative,0.3958311318877611,model_autofill,False
১৭ হারাচ্ছো! তুমি ৮ নিয়ে পড়ে আছো?,Sarcastic_negative,0.4322353244150861,model_autofill,False
যারা বলে এখন মুজিব কোট তুলে রেখে দিছি আওয়ামী লীগ আসলে নামাবো তাদের বেলায় কি??,Sarcastic_negative,1.0,manual_second_pass,False
আমরা চান্দাবাজি সন্ত্রাসী ঢাকা ৮ আসনে দেখতে চাই না,Negative,1.0,manual_second_pass,False
ঢাকা ৮ আসনের জনগণের রুচি কি এতই খারাপ এদেরকে এমপি বানাবে।!,Negative,1.0,manual_second_pass,False
আমরা আশাবাদী এবারের নির্বাচনে বাংলাদেশের জনগণ চাঁন্দাবাজ খুনিদের কে ও আর সুযোগ দেবে না ইনশাআল্লাহ,Positive,0.4239516375580363,model_autofill,False
বাংলাদেশের মানুষ ন্যায় ইনসাফ আজাদী ভিত্তি শাসন চায়।,Positive,0.4579628139419155,model_autofill,False
চাদাবাজ সন্ত্রাসী লুটপাটের দেশ সাধারণ মানুষের পছন্দ করে না।,Positive,1.0,manual_second_pass,False
"হ দিবোনে তোমারে,,",Negative,0.3750407133991414,model_autofill,False
"হাসিনাকে ভুলে গেলেন,আপনার ঢাকা ব্যাংকে একটা ফুলের টোকাও লাগতে দেয় নাই।",Sarcastic_negative,1.0,manual_second_pass,False
দেশে আসলেই তোমাকে বাগুন ভরে দেয়া হবে,Neutral,0.3552920269050996,model_autofill,False
ওই নির্বাচনে আপনার পরাজয় নিশ্চিত হবে ইনশাআল্লাহ,Negative,0.3476765057773894,model_autofill,False
এই পাগল কে ভোট দিলে দেশের বারোটা বেজে যাবে,Negative,0.3798676330121537,model_autofill,False
সব জায়গায় তো আওয়ামী তো সবাই এখন বি,Negative,1.0,manual_second_pass,False
আরে ভাই আপনারা সবাই মির্জা আব্বাসকে নিয়ে আবোল তাবোল বলতেছেন কেউ পজিটিভ কথা বলেন।,Positive,0.4262818785920043,model_autofill,False
এটা সাধারণ মানুষ জানে,Positive,1.0,manual_second_pass,False
ভারতীয় রং বরং ভারতীয় চামড়া পড়ে আছেন।,Negative,0.4381840254568755,model_autofill,False
সুর পালটে গেলো মনে হচ্ছে,Sarcastic_negative,0.413354542540847,model_autofill,False
"হেতি নাকি হত্যাকারী, সবাই কয় আরকি৷",Negative,0.3665916673910034,model_autofill,False
টেম্পু,Sarcastic_negative,1.0,manual_second_pass,False
ভন্ড তার নিজের দলের লোকেরাই আনুষ্ঠানিক ভাবে দলে আওয়ামীলীগের লোককে আশ্রয় দিয়েছে,Negative,0.361366971307718,model_autofill,False
হাদী হত্যার প্রধান নায়ক,Negative,0.4146677765556631,model_autofill,False
এই ঢাকা আট নির্বাচনই জন্যই আজ হাদী ভাই কবরে।,Negative,0.4510282470099283,model_autofill,False
কাকা বিএম্পি আমিলীকগে জায়গায় জায়গায় গ্রহন করছে,Negative,0.407497739306378,model_autofill,False
চান্দাব্বাস। এলাকায় এমন কোনো দোকান নাই চান্দা না তুলে,Sarcastic_negative,0.5362975005615543,model_autofill,False
"মির্জা আব্বাস এর পাপের ফসল, নাসিরউদ্দিনের পাটোয়ারি",Negative,0.3392702396723203,model_autofill,False
চাচা ভালো হয়ে যাও চাদাবাজী করা বাদ দাও মানুষ কিন্তু সব জানে,Positive,0.4939205768921766,model_autofill,False
পিওনের ছেলে আন্ডার মেট্রিক কিভাবে একটা ব্যাংকের মালিক হয় এটাই মাথায় ঢুকে না আমার।,Negative,0.3569306505757058,model_autofill,False
দলে দলে লীগের প্রার্থী দিচ্ছে আবার বলে যায়গা নাই।,Negative,0.3362779163068757,model_autofill,False
এটা আবার নতুন কি,Negative,0.3515541841097131,model_autofill,False
কোন ষড়যন্ত্রে কাজ হবে না ইনশাআল্লাহ ধানের শীষের বিজয় সুনিশ্চিত,Positive,0.3696777329565665,model_autofill,False
অলি অলি,Sarcastic_negative,1.0,manual_second_pass,False
Canddabazz.com,Sarcastic_negative,0.3574898602354987,model_autofill,False
জনগণ দেখবে,Sarcastic_negative,0.3261755809578119,model_autofill,False
"ইজ্জত থাকতে মনোনয়ন প্রত্যাহার করেন, নইলে জমানত বাজেয়াপ্ত হবে।",Sarcastic_negative,1.0,manual_second_pass,False
বটবাহিনী মির্জা আব্বাসের পিছনে ভালই লেগেছে তবে যারা কমেন্ট করছে এরা সবাই সারা বাংলাদেশের বটবাহিনী!,Negative,0.3606646933173195,model_autofill,False
ইনশাআল্লাহ জয় আপনার হবে,Positive,1.0,manual_second_pass,False
বট বাহিনী,Negative,1.0,manual_second_pass,False
আসল কথা,Sarcastic_negative,0.3626461281873805,model_autofill,False
বি এন পি একটি ক্ষুদার্ত সন্ত্রাসী দল এদের মুখে দেশের মানুষ পেশাব পায়খানা করবে অপেক্ষা শুধু সময়ের!!!,Negative,1.0,manual_second_pass,False
খুনিদেরকে দেশের মানুষ ক্ষমতাই দেখতে চায়না,Negative,0.4230515272091377,model_autofill,False
বিএনপি পাশ করলে ও আপনি ডাবল ফেল হবেন ।,Neutral,0.3345344107231502,model_autofill,False
আপনাদেরকে শায়েস্তা করার জন্য একমাত্র শেখ হাসিনাই যথেষ্ট ছিল,Negative,1.0,manual_second_pass,False
অথচ দশ বছর পরে শেখ হাসিনাকে ফিরিয়ে আনার ঘোষণা দিলেন বিএনপির এক নেত্রী,Negative,0.371912464516494,model_autofill,False
সময়ের অপেক্ষা মাএ,Negative,1.0,manual_second_pass,False
এইবার মনে হয় তোমারে লাল কার্ড দেখাবে জনগণ,Negative,1.0,manual_second_pass,False
insha'Allah Mirza saheb,Sarcastic_negative,1.0,manual_second_pass,False
যারা থাকেই রংয়ের মধ্যে তাদের গায়কি রংলাগানো যায়।,Negative,0.4087106824050857,model_autofill,False
NCPভাইদেরকে অনুরোধ করবো আমজাদ ভাইকে সমর্থনের কথা কেন্দ্রীয়ভাবে সমর্থন এবং জানানো হোক এর ফলে পলাশে আপনাদের জন্য এবং সকল জনগণের জন্য ভালো হবে,Positive,0.3879355572410694,model_autofill,False
ইনশাআল্লাহ ঢাকা ৮ টের মানুষ আপনাকে গ্রহণ করবে না?,Negative,0.4383974404108957,model_autofill,False
tui jan war hadi k marsos,Neutral,0.7186830306555643,model_autofill,False
এবার চির জীবনের জন্য হারাতে হবে ঢাকা ৮ আসন। ১৭ পর ঘেউ ঘেউ জনগণ তার জানে কে আপনি সন্ত্রাস,Sarcastic_negative,1.0,manual_second_pass,False
"লুটতরাজ, চাঁদাবাজি ও স্বৈরাচার মুক্ত দেশ গঠনে অবশ্যই আমাদের ""হ্যা"" ভোট দিতে হবে।",Neutral,0.3633828677648078,model_autofill,False
আওয়ামীলীগকে আশ্রয় দেওয়া একমাত্র দল বিএনপি,Negative,0.4909169612701732,model_autofill,False
আলহামদুলিল্লাহ আমরা হাজী সেলিমের রিপ্লেসমেন্ট পেয়ে গেছি,Negative,0.4144228752828925,model_autofill,False
তোমার কপালে সনির দশা।,Negative,0.3401224419662869,model_autofill,False
"Kuttar bachcha futfute sundor, chandabbas kuni hadir",Sarcastic_negative,0.43023681289424,model_autofill,False
ধন্যবাদ মির্জা ভাই,Positive,1.0,manual_second_pass,False
কিন্তু আওয়ামী লীগ কে বিএনপি গ্রহণ করতেছে সামনেও করবে।,Negative,0.4355867368067201,model_autofill,False
হাদী দেখাতে চেয়েছিল:—,Negative,0.4021590387119973,model_autofill,False
আমি আওয়ামী লীগ করি,Neutral,1.0,manual_second_pass,False
বটদের কমেন্ট ভরা।,Negative,1.0,manual_second_pass,False
আর যাই হোক ঢাকা ৮ আসনের লোকজন আপনাকে এমপি হিসেবে দেখতে চায় না। আপনি এমপি হচ্ছেন না এই কথা ক্লিয়ার,Negative,1.0,manual_second_pass,False
আপনি মনে মনে ধরে নেন,Sarcastic_negative,0.4372590674193904,model_autofill,False
জোকার,Sarcastic_negative,1.0,manual_second_pass,False
মানুষ চান্দাবাজের বিরুদ্ধে আছে।,Sarcastic_negative,0.369283538266405,model_autofill,False
খালেদা জিয়ার বাসার সামনে থেকে একটা বালুর ট্রাক সরাতে পারে নাই আবার বড় বড় কথা বলে,Positive,0.4134806568056332,model_autofill,False
তোমার আর বেইল নাই,Negative,0.4019124679009478,model_autofill,False
Mukh O mukhosh...,Neutral,1.0,manual_second_pass,False
পাঁচ বার দুর্নীতিতে চেম্পিয়ান,Sarcastic_negative,1.0,manual_second_pass,False
মানুষ আর পুরান খায় না,Positive,0.472272175219097,model_autofill,False
হাদী মারলো কারা জাতি জানতে চায়,Negative,0.3694844160844305,model_autofill,False
ইনশাআল্লাহ দাঁড়িপাল্লা,Positive,0.4400870908590628,model_autofill,False
Muhammad Yasin মির্জা আব্বাসের আসে পাশে আসার মতো হতে অনেক যুগ লাগবে,Negative,0.3628735702480859,model_autofill,False
ইনশাল্লাহ এখানে আপনি বিশাল ব্যবধানের জয় হবেন ধানের শীষ,Positive,1.0,manual_second_pass,False
"মানুষ এখন কথায় বিশ্বাস করে না,কাজে।",Positive,0.4980703397909032,model_autofill,False
তোমারদের কথায় ভেজাল আছে,Negative,0.3714252128985505,model_autofill,False
#হাদীর_হত্যাকারী,Negative,0.4559413151172722,model_autofill,False
মুখে মুখে ..,Neutral,1.0,manual_second_pass,False
খুনি আব্বাস!,Negative,0.5775465605394164,model_autofill,False
ধান্দাবাজের মুখে রাম রাম,Sarcastic_negative,0.4310292014686899,model_autofill,False
হাসিনা যখন আসবে আপনার কেউ বাংলাদেশ এ থাকবেনা।,Sarcastic_negative,0.3801240893550777,model_autofill,False
মির্জা আব্বাস তোমাকে যারা ভোট দেবে তারা হাদীর সাথে বেইমানি করবে ইনসাফের সাথে বেইমানি করবে ইনকিলাব জিন্দাবাদ,Positive,0.3906846400477322,model_autofill,False
ধানের শীষ,Sarcastic_negative,0.3401039761586544,model_autofill,False
চান্দ আব্বাস,Negative,0.369948895339068,model_autofill,False
আল্লাহ বিএনপি থেকে বাংলাদেশকে হেফাজত করুক যেভাবে করেছেন আওয়ামীলীগ থেকে। আগামীর বাংলাদেশ হবে ইসলামের বাংলাদেশ ইনশাআল্লাহ।,Positive,0.3603605860240696,model_autofill,False
মানে ৮ আসনে আপনাকে খেয়ে দিবে নাসির পাটোয়ারী বাকিটা সময়ে বলে দিবে,Sarcastic_negative,0.3885771466225414,model_autofill,False
এই খুনির বিচার আমরা করবই ইনশাআল্লাহ।,Negative,0.5634871700169594,model_autofill,False
তরা ত ভারতেরি এজেন্ট রং আর লাগাইব কি,Negative,0.4114606110908806,model_autofill,False
হা/লারা,Negative,1.0,manual_second_pass,False
হেতেন শীতে হাগল ওই গেছে।,Sarcastic_negative,0.4393135913289277,model_autofill,False
